,content,categories,priority
0,pagasa advisory yellow warning metro manila occasional heavy rain next hr flood possible ,,
1,pagasa advisory red warning metro manila heavy intense rain next hr flood low lie area near ,,
2,hey guy use hashtag rescue operation flood monitoring ,,
3,use hashtag allow all medium outlet monitor tweet relate flood rescue operation thanks ,,
4,rather class than see people my country suffering die ,,
5,rather class than see people my country suffering die ,,
6,walk thru flood water take one dose doxycycline guard against leptospirosis via ,,
7,yrs old lady trap kapiligan st araneta subd qc all grill window locked water already floor help ,,
8,flood chaos philippine capital flood water rise part philippine capital tuesday http ,,
9,mcdonald store open metro manila now accept donation kind rice noodle good etc flood vi ,,
10,send love worry philippine also send aid donation use info ,,
11,mcdonald store open metro manila now accept donation kind rice noodle good etc flood vi ,,
12,send love worry philippine also send aid donation use info ,,
13,hi every tweet hashtag donation philippine victim pls retweet unt ,,
14,hi every tweet hashtag donation philippine victim pls retweet unt ,,
15,mcdonald store open metro manila now accept donation kind rice noodle good etc flood vi ,,
16,fact genesis noah ark today ,,
17,just see flood manila tv sweet jesus sincerely hope your loved one safe didn realize ,,
18,public service announcement gt pls fast response help way ,,
19,flood uerm hospital almost floor where nursery rescuer whole day ,,
20,uerm really need help flood almost floor where nursery rescuer whole day ,,
21,uerm really need help flood almost floor where nursery rescuer whole day ,,
22,don panic genesis god promise never again think positive positive pinoys ,,
23,mcdonald store open metro manila now accept donation kind rice noodle good etc flood vi ,,
24,family need rescue address guirayan st brgy dona imelda araneta ave qc pls ,,
25,urgent help need ust hospital flood reach building level ,,
26,ust hospital generator already die please send some rescuer ,,
27,uerm really need help flood almost floor where nursery rescuer whole day ,,
28,ust hospital generator already die please send some rescuer ,,
29,hospital need help food amp water ust hospital uerm philippine general hospital pls ,,
30,mcdonald store open metro manila now accept donation kind rice noodle good etc flood vi ,,
31,don panic genesis god promise never again think positive positive pinoys ,,
32,hi every tweet hashtag donation philippine victim pls retweet unt ,,
33,hi every tweet hashtag donation philippine victim pls retweet unt ,,
34,don panic genesis god promise never again think positive positive pinoys ,,
35,keep safe filipinos thanks mr sun pray philippine ,,
36,mcdonald restaurant open metro manila still accept donation rice noodle bottle water etc flood vic ,,
37,sabi nga nila work cause applause ,,
38,snow africa drought america flood manila volcanic eruption new zealand seriously next ,,
39,snow africa drought usa flood manila volcanic eruption new zealand earthquake california trust go ,,
40,snow africa drought usa flood manila volcanic eruption new zealand earthquake california trust go ,,
41,snow africa drought usa flood manila volcanic eruption new zealand earthquake california trust god ,,
42,people need help may text via ,,
43,class all level suspend tomorrow dec ,,
44,keep safe ,,
45,announcement pagasa super typhoon strong my feeling kingina mo advise feel same way too ,,
46,announcement pagasa super typhoon strong my feeling kingina mo advise feel same way too ,,
47,announcement pagasa super typhoon strong my feeling kingina mo advise feel same way too ,,
48,announcement pagasa super typhoon strong my feeling kingina mo advise feel same way too ,,
49,announcement pagasa super typhoon strong my feeling kingina mo advise feel same way too ,,
50,more than local amp foreign volunteer join dswd employee repacking relief good ,,
51,keep safe ,,
52,now move west northwest km heavy torrential rainfall mm expect within km diameter ,,
53,announcement pagasa super typhoon strong my feeling kingina mo advise feel same way too ,,
54,keep safe everyone ,,
55,keep safe everyone ,,
56,announcement pagasa super typhoon strong my feeling kingina mo advise feel same way too ,,
57,keep safe everyone ,,
58,announcement pagasa super typhoon strong my feeling kingina mo advise feel same way too ,,
59,now anc dilg press conference ,,
60,typhoon hagupit ruby hit how aid pet peril right now follow ,,
61,need pray philippine please help people still recover re house break ,,
62,good morning kathdevotees here abroad keep safe pray ,,
63,lazy kind monday ,,
64,thank lord your divine protection agains typhoon prayer really work ,,
65,my mind need little more explanation god way let u know exist keep your mind ,,
66,some u stay bed because regain your strength style ,,
67,good day ,,
68,oooh rain now ,,
69,keep safe guy ,,
70,fry garlic rainy monday morning perfect corned beef ,,
71,wish qualifies just people buy stock christmas shopping ,,
72,pray safety everyone ,,
73,hop family ok amp safe typhoon ,,
74,all paulinians class tom again ,,
75,today just one reason why love work government ,,
76,let sing song win tag along ,,
77,stormy weather signal na tsk tsk take care guythhh ,,
78,bpi branch area affect close pm early depend local weather condition ,,
79,look like right now coast legazpi after ,,
80,family preemptively evacuate brgy pinugay baras rizal due threat flood rise lake water ,,
81,just get back office wasn inform work suspend today just hate when delay announcement ,,
82,announcement pagasa super typhoon strong my feeling kingina mo advise feel same way too ,,
83,important local apps install dost project noah arko available io android ,,
84,keep safe madlang people ,,
85,click tropical storm kph ,,
86,goodmooooorning safe prepare err one ,,
87,get mine last week ,,
88,goodmorning start darren espanto myxinvasion darren soloalbum top itunes ,,
89,update fisherman sorsogon city venture out sea amid rescued via via anc alert ,,
90,morning ,,
91,rain day ,,
92,least dead typhoon batter philippine ,,
93,pray everyone safety ,,
94,wait press briefing update ,,
95,just pray god save u keep u safe ,,
96,safe everyone ,,
97,know philippine well please safe hear news here typhoon powerful last year hope true ,,
98,thankyou lord re safe ,,
99,happen turn worse drive out city your family re cod ,,
100,survive look like ll strand while yet all flight cancel ,,
101,goodmorning once again keep safe everyone god bless ,,
102,national regional local emergency number area affect ,,
103,breakfast like bad weather ,,
104,nabua road albay passable small vehicle passenger walk instead report ,,
105,keep safe ,,
106,storm surge ,,
107,somebody spend yellow gemstone dispell gust lol ,,
108,goodmorning keep safe everyone ,,
109,movie marathon internet hot choco cuddle weather ,,
110,goodmorning cold ,,
111,bed weather ,,
112,pray safety everyone nice day everyone ,,
113,how smile after please check our background ,,
114,keep safe ,,
115,folk lieu storm cancel mb christmas party tonight see all next monday dec ,,
116,goodmorning signal number parin kami ,,
117,calm before storm ,,
118,good morning stay safe everyone ,,
119,pray my compassion brother family ,,
120,watch take over sea ,,
121,stay safe philppines ,,
122,safe everyone typhoonruby classsuspended restmode ,,
123,anonymous say when find out typhoon hit philippine my first thought oh my goodness ,,
124,typhoon look incredibly powerful thankfully look like dissipate ,,
125,moonlight over astronaut take more pic directly above eye ,,
126,philippine typhoon weaker still hazardous ,,
127,keep safe everyone ,,
128,pagasa although downgrade tropical storm still prepare bad case scenario ,,
129,super typhoon tropical storm continue pray still safe vigilant ,,
130,cook lunch while background ,,
131,typhoon hagupit phillippines degrade tropical storm over evacuate phillippines ,,
132,christmas time anther typhoon hit philippine once again keep safe every one ,,
133,pray philippine ,,
134,hit southern tip batangas between ,,
135,people evacuate padre burgos calauag lope quezon hr heavy rain here high flood risk ,,
136,typhoon hagupit toll rise three people evacuate philippine ,,
137,take care baes hagupit aka ruby almost here love all god bless ,,
138,announcement pagasa super typhoon strong my feeling kingina mo advise feel same way too ,,
139,may may look someone willing help u update page twitter team farro philippine ,,
140,please pray philippine typhoon ruby reach landfall philippine area ,,
141,passport consular service suspend due ruby ,,
142,start ,,
143,now anc pagasa press conference ,,
144,good job sec mar salamat ,,
145,cold morning few drizzle ,,
146,since able run my errand go grocery shop instead wine must pic ,,
147,wish all best response ,,
148,emergency hotlines ,,
149,typhoon hammer philippine fight our survival trfn ,,
150,edsa more beautiful without billboard photo george tapan true ,,
151,my prayer go out ,,
152,let u give moment pray our country pray every filipino find our way christ never let u down ,,
153,stay safe everyone wag ng mag selfie sa daan na may caption na love walk rain coz one know cry ,,
154,today lazy monday ,,
155,mistress element inspire me make hope everyone ok ,,
156,stay safe everyone ,,
157,wan na dance love dance again ,,
158,call home mom say re fine only little rain now sure might rain harder later stay safe always ,,
159,filipino strong than ruby ,,
160,goodmorning ,,
161,bless able leave philippine right before typhoon beyond worried my family ,,
162,mirof resource inc hire urgent kitchen assistant legazpi ,,
163,home ,,
164,win best dressed male night last night our sector christmas party get starbucks gc hey ,,
165,wth signal here omg save u ,,
166,typhoon ruby go away philippine ,,
167,after hagupit filipino spirit still unbreakable ,,
168,weather satellite feed dec via ,,
169,hear my mama voice completely make my day week until come home glad safe storm ,,
170,reckon hagupit ,,
171,take action support human right defender philippine ,,
172,god u let pray everyone safety ,,
173,pagasa expect exit par thursday evening ,,
174,welcome ,,
175,thank god aint cebu anymore god bless pinoys ,,
176,like how ndrrmc usec answer medium ,,
177,good morning monday stay safe everyone ,,
178,pagasa briefing now ongoing ,,
179,trend philippine pht ,,
180,typhoon ruby ,,
181,atm all me why cool man despite typhoon hagupit ,,
182,leave today because ,,
183,image hagupit ,,
184,because ,,
185,attend shortfilm festival award night munoz ecija hope follow ,,
186,australia extend sympathy support filipinos affect via ,,
187,monitoing via twitter ,,
188,even tho don family area typhoon hitting ,,
189,don leave your pet unattended ,,
190,accord my record gd weather only today next golf day next week ,,
191,hide mayhaps ah ok now make sense lol ,,
192,rain again keep safe everyone ,,
193,ali ruby ali ,,
194,thanks man hopefully hagupit leaf before arrive ,,
195,typhoon hammer philippine fight our survival ,,
196,singapore today update hundred thousand filipino http ,,
197,keep safe everyone ,,
198,keep safe everyone ,,
199,keep safeeee ,,
200,despite news hagupit here some good news all proud ,,
201,breaking downgrade into tropical storm via ,,
202,light relief ops last thing want see food pack name politician like one binay before ,,
203,despite bad weather should stay positive pray everyone safety god bless ,,
204,goodmorning gabby keep safe mag ingat kay labyu ,,
205,grrr freeze ,,
206,hey just gon na shake off shake off ,,
207,god always here stay safe everyone ,,
208,pray protection suspension ,,
209,ohhh lord please guide u today hope every body safe ,,
210,why get ta rude stay age dry ,,
211,please help u all prayer victim typhoon ruby here philippine thanks ,,
212,drought ca typhoon philippine oh how nature work ,,
213,pagasa hour tuesday morning km southwest quezon city very very close ,,
214,keep safe guy take care cto mallen vid ,,
215,please mom thanks ,,
216,pray philippine ,,
217,understanding central hub all related concern ,,
218,yeah sta peregrina national high school ,,
219,dont school today bc typhoon come ,,
220,why lamig ,,
221,take extra good care philippine ,,
222,understanding central hub related concern ,,
223,look like right now coast legazpi after ,,
224,any volunteer work pack relief good update u please re willing help ,,
225,stay safe people nearby province spirit weather any storm like ,,
226,hit massively ,,
227,mint gale threaten recovery haiyan ,,
228,like winter here lol ,,
229,understanding central hub related concern ,,
230,child need your help ,,
231,stay safe everyone god bless ,,
232,reckon ,,
233,typhoon christmas win stop filipino way celebrate most awaited holiday year ur nothin ,,
234,here come rain ,,
235,typhoon ,,
236,understanding central hub related concern ,,
237,keep safe everyone don forget pray ,,
238,typhoon update via ,,
239,stay safe philippine ,,
240,monday strangeness spicy champorado crispy because bacon chocolate ,,
241,stay safe guy ,,
242,moonlight over astronaut take more pic directly above eye ,,
243,won train today smh ,,
244,via help u assess school damage due tweet u your photo hashtag ,,
245,thousand flee hagupit nears philippine ,,
246,everything own reason ,,
247,photo stay safe ,,
248,update ,,
249,bella bite blog cyclone update aka good data uni wisconsin oz ,,
250,help respond affect donate every little make difference ,,
251,pray protection suspension ,,
252,home la paz leyte build thru build back safer survive ,,
253,pray philippine ,,
254,typhoon hammer philippine fight our survival trfn yahoo news ,,
255,wintry mix hit monday morning hagupit weakens ,,
256,due typhoon class office only open till also give way our relief effort stay dry safe everyone ,,
257,national regional local emergency number area affect ,,
258,philippine typhoon weaker still hazardous ,,
259,everyone safety all shipment today tom amp wed due typhoon ruby expect landfall ,,
260,typhoon typhoon go away ,,
261,think ,,
262,wan na help victim donate here through ,,
263,moreno people don want evacuate wishful think namin na lahat makinig pero mayroon talagang hindi ,,
264,just say krtey right now ,,
265,moonlight over astronaut take more pic directly above eye ,,
266,god u let pray everyone safety ,,
267,keep safe guy may god bless u ,,
268,keepsafe guy ,,
269,lord cover u your most precious blood ,,
270,mayor jun rosales senior citizen dead catarman northern samar least house destroy ,,
271,guy thanks ,,
272,response typhoon show lesson learn year ago ,,
273,re immortal fulfill deadline ,,
274,rude comment ok give japan more capable hindi pa rin tama komento nya sure re journalist ,,
275,philippine typhoon weaker still hazardous hagupit leave three people dead force more than million away ho ,,
276,safe step emergency kit saw early very informative ,,
277,typhoon look incredibly powerful thankfully look like dissipate ,,
278,rain rain go away ,,
279,lunch serve tara cuidad grande village bagbaguin ,,
280,stay safe ,,
281,stay safe re gon na hit typhoon evening ,,
282,now felt metro mla safe everyone ,,
283,typhoon hite through philippine ,,
284,god u let pray everyone safety ,,
285,repostapp via abc hamish macdonald dig themselves out ,,
286,class tomorrow stay safe all filipino mutuals ,,
287,make storm still wave sea hush psalm esv ,,
288,weaker still hazardous ,,
289,quezon city dark cloud bring light rain over fairview area via ,,
290,while watch movie my brother watch maze runner ,,
291,philippine typhoon weaker still hazardous ,,
292,resident ravaged eastern samar hold up help me sign ,,
293,safe ,,
294,update follow ,,
295,please leave please ,,
296,now downgrade tropical storm good hear still make sure stay safe don go out don need ,,
297,cold monday everyjuan ,,
298,philippine dead powerful storm ,,
299,live play ,,
300,astronaut view hagupit ,,
301,close ,,
302,t may typhoon now unload some rain here sure due pass here ,,
303,typhoon hammer philippine fight our survival via ,,
304,moreno good advise technology our first responder put too much danger when rescue people ,,
305,very early supension announcement again ,,
306,now anc pagasa press conference via anc alert ,,
307,pray protection suspension ,,
308,adprins final freakin thursday havent fimed our commercial yeeeet ,,
309,huhhh bore raining hop black out happen ,,
310,re class suspension tomorrow december stay safe totoo ba ,,
311,post photo facebook album akbayanihan volunteer ,,
312,get stick philipinnes island cause storm all my flight cancel bad infrustructure make devastate ,,
313,pummels kill least two ,,
314,rappler downgrade into tropical storm pagasa storm warning ,,
315,while typhoon ruby hit philippine indonesia must prepare bagyong baldo ,,
316,stay safe alert ready amp dry all ,,
317,god u let pray everyone safety rubyph ,,
318,strand sa house cant go out ven inip much ,,
319,mrt ops until north ave taft ave mrt oic ,,
320,manila hr monday light steady rainfall coast guard military city national police deploy ,,
321,non stop rain since here little strong now safe everyone crucial hour calabarzon metro manila ,,
322,frequent typhoon like threaten food security action vital ,,
323,when give command even wind wave obey him luke nlt ,,
324,lord god bless philippine people protect u your guidance love rubyph ,,
325,one thing say filipino though re resilient ,,
326,farm damage close say da ,,
327,opo makulimlim thank god light rain lang hagupit guest re happy late ,,
328,too busy check update twitter say ,,
329,understanding central hub related concern ,,
330,gig gig ,,
331,weakens over read more ,,
332,another super typhoon hope last typhoon ,,
333,lord god bless philippine people protect u your guidance love ,,
334,hate donut ruin place im gon na freakin kick ur arse out our country freakin murderer ,,
335,filipino stay safe calm ,,
336,video powerful typhoon nears philippine ,,
337,because hagupit typhoon my plan today ruin waaahhhh please typhoon typhoon go ,,
338,good laugh read some tweet re ,,
339,typhoon slam philippine picture ,,
340,too ,,
341,stay safe let pray over our nation god always u ,,
342,strong wind cloudy sky heavy rain amp cold air feel ruby keep safe ,,
343,pray philippine ,,
344,philippine typhoon hagupit weakens ,,
345,take care keep safe guy ,,
346,update come ,,
347,keep safe philippine ,,
348,all people philippine stay safe brace typhoon ruby make land fall ,,
349,happy fiesta ,,
350,sandara park philippine beauty splurge all over innocence cr ,,
351,typhoon tear down home disaster weary ,,
352,also say stay safe everyone ,,
353,anyone see typhoon coverage philippine ll definitely change one perspective truly important ,,
354,muntinlupa city class all level suspend tomorrow dec via move pt pls ,,
355,joelbyn datu ,,
356,see any tweet group orgs re relief donation pls tag me compile map relief center ,,
357,keep safe ,,
358,volunteer orientation continuous repacking relief assistance ,,
359,due tropical storm ruby hagupit ff cebu incheon amp incheon cebu flight dec amp cancel ,,
360,house build recovery funding remain standing after ,,
361,glad hagupit ruby weaken ang huling cha cha ni anita tomorrow fullybooked view ,,
362,philippine may seek up tonne rice import after typhoon ,,
363,much left still smile much left jerry biraman house after ,,
364,please pray philippine ,,
365,thank lord let our yearend event pas hope storm get lose sea ayaw na po namin ng baha ,,
366,god u ,,
367,trend philippine pm pht alonzo ,,
368,too shall pass ,,
369,stay safe everyone ,,
370,dead evacuate typhoon slam philippine ,,
371,trend philippine pm pht ,,
372,dead evacuate typhoon slam philippine ,,
373,my prayer win help government pig system too powerful ,,
374,lord god bless philippine people protect u your guidance love ,,
375,storm really brew out hope people safe ,,
376,miss talk hahahaha fine how typhoon here philippine ,,
377,reduce tropical storm orange warning hoist over metro mla let u prepare heavy intense rain keep safe dry ,,
378,typhoon look incredibly powerful thankfully look like dissipate ,,
379,watch live update break news stream live anc dzmm teleradyo ,,
380,weakens over ,,
381,keep safe ,,
382,would rather go school than see country suffer ph ,,
383,typhoon hammer philippine fight our survival via ,,
384,reuters philippine may seek up tonne rice import after typhoon ,,
385,lord forever grateful your save grace thank ,,
386,weakens ,,
387,update accordingly keep safe rizalians ,,
388,keep safe everyone ,,
389,make bad boy good weekend ,,
390,rain lash part investigation into space ,,
391,stay safe philippine ,,
392,love cuddle weather all still pray errbody safety ,,
393,woooo almost hour since start pour nonstop san pablo rain even get hard since last night ,,
394,feel ,,
395,yesterday million evacuate typhoon engulfs photo ,,
396,announcement pagasa super typhoon strong my feeling putek advise feel same way too ,,
397,late field bulletin via philippine embassy ,,
398,look comfy still choose my bed please ,,
399,more like ,,
400,typhoon look incredibly powerful thankfully look like dissipate ,,
401,lt typhoon hagupit gt bad bed weather keep our morning class student brave storm train ,,
402,fmts only accept type inpatient surgical emergency care med team amp fmts exsting partnership lgu deployment site ,,
403,typhoon hagupit continue sweep across philippine despite some death widespread damage appear avoid ,,
404,hope everyone find time hear mass say little prayer feast immaculate conception ,,
405,class suspension december tuesday ,,
406,reason class some office cancel today tomorrow peep please stay safe ,,
407,trend philippine pm pht ,,
408,keep safe guy ,,
409,sea threaten coast villager during ,,
410,keep safe everyone here philippine pray all god bless u all ,,
411,take care guy ,,
412,updated class suspension tuesday december ,,
413,keep safe always guy ,,
414,powerful typhoon hagupit slam into eastern philippine via ,,
415,bukas all level ,,
416,safe ,,
417,keep safe everyone ,,
418,such cold strong wind outside ,,
419,pray philippine especially my family right now ,,
420,don pray suspension pray protection ,,
421,include one your tweet my blog tell me don like ll remove tnx ,,
422,whoever read please pray philippine ,,
423,typhoon tear down home disaster weary ,,
424,all stay safe love ,,
425,worth post ,,
426,champorado amp tuyo kind weather ,,
427,bos cat own my bed hahaha ,,
428,include one your tweet my blog tell me don like ll remove tnx ,,
429,hello mr blue sky ,,
430,late field bulletin via philippine embassy ,,
431,affected gazette ,,
432,ocd regional dir alejandro lv estimate damage agriculture around rice industry most affected ,,
433,keep safe everyone pray always godbless ,,
434,don say calamity go somewhere else affect other nation korina sanchez your head big even use anymore ,,
435,stay safe everyone ,,
436,sun rise again alright ,,
437,typhoon hagupit continue sweep across philippine despite some death widespread damage appear avoid ,,
438,please advise mrt lrt operation end trip early due stay safe everyone ,,
439,safe my dear country ,,
440,keep safe prepare god u let pray everyone safety ,,
441,bank open today decide close early also saw several office worker already head home paano naman kami ,,
442,stay safe everyone ,,
443,stay safe everyone ,,
444,keep safe everyone god great than ,,
445,very dark sky make presence felt all way here taiwan hope flight ,,
446,class suspend today tomorrow stay safe everyone ,,
447,fam let pray filipino fam philippine bc typhoon filipino fam stay safe guy thanks ,,
448,understanding central hub related concern via ,,
449,actually get back saturday evacuate philippine because typhoon ,,
450,mt typhoon look incredibly powerful thankfully look like dissipate via ,,
451,dont know makati ,,
452,awww sarah stay safe guy ,,
453,suddenly everything make sense me lt ,,
454,dear god please protect u typhoon ruby sincerely yours philippine ,,
455,aftermath typhoon hagupit ,,
456,love one gather around tiny casket calbayog samar lone fatality via ,,
457,photo rain hard outside keep safe dry love god bless u all ,,
458,preparation amaze think filipino well learn yolanda experience appreciate tho keep safe everyone ,,
459,nature negotiate climate change here ,,
460,call donation drop off point vinzons hall query contact ayna punzalan ,,
461,happy feast day immaculate concepcion know u vs ,,
462,thank god ruby hagupit downgrade tropical storm though ,,
463,rainy afternoon po keep safe guy godbless ,,
464,stay prepared vigilant safe everyone ,,
465,announcement pagasa super typhoon strong my feeling kingina mo advise feel same way too ,,
466,worry lot abt ppl my country make me sad all atm pray when where volunteer help ,,
467,flood update ,,
468,lord god pray spare our country destructive effect protect u wrath typhoon ,,
469,outsmart traffic jam amp flood waze app ,,
470,good over cautious than caught unprepared stay safe everyone ali na please ,,
471,pray protection suspension ,,
472,continue weaken cross southern quezon morning now over tayabas ,,
473,welcome ,,
474,rain rain go away come again another year ,,
475,bagyo sleep over da best ,,
476,afp u japan australia singapore advance assessment team arrive country u drt standy villamor air base ,,
477,weakens storm dead adsbygoogle window ,,
478,stay safe philiphines ,,
479,walang pasok bukas lord help philippine please may time avenue u strong faith ,,
480,trend philippine pm pht ,,
481,keep safe everyone pray pray pray ,,
482,keep safe everyone ,,
483,gt gt charge your phone tablet laptops powerbanks etc ok bye ,,
484,interaksyon class suspension december tuesday ,,
485,here come ,,
486,class tomorrow ,,
487,now sleep tight bukas ,,
488,pray philippine ,,
489,late night promotion ,,
490,prepare ,,
