,content,categories,priority
9988,gangler alert hurricane joseph move prove category still grow hit shelby week get prepare now ,,
9989,response devastation hurricane florence leave behind here update tomorrow service instead church re go church ,,
9990,update worship thankful lord protection during storm strong wind celebrate storm departure tomorrow worship sunday ,,
9991,tonight ten hear one man story cling tree seven hour hurricane until member ny task force able safely rescue him ,,
9992,dear all national news outlet cover hurricane florence horry county pronounce ree thank love south carolina ,,
9993,more downtown photo ,,
9994,my stomach knot all flooding damage whiteville ,,
9995,close indefinitely our crew safe brick stick rebuild wish our friend community speedy recovery ,,
9996,when come rescue grateful aspect human kindness folk stop nothing help animal ,,
9997,officially lose power here mount ulla nc ,,
9998,hurricane prep alcoholic smoothy ,,
9999,deny nearly death maria puerto rico silence our death here north carolina need leader asleep wheel ,,
10000,concern orographic lift mtns once begin really move flood similar hurricane ,,
10001,think gain pound since hurricane hit u ,,
10002,strong rain band produce gusty wind heavy rainfall across portion county ,,
10003,continue pour down eastern nc get through power recovery swift consider large impact ,,
10004,don please stop spread false information person county flash flooding numerous tree down across county just southern nc everybody issue ,,
10005,flo wore out bark wind ,,
10006,situation morning yuck official urge driver stay off road unless absolutely necessary tree fall power line go down flash flooding continue flash flood warning set until though may extend ,,
10007,hurricane run felt great get out run rain still fall hurricane florence much flooding expect coming day ,,
10008,go walk through downtown wilmington nc take couple pic wilmington riverfront ,,
10009,me share myrtle beach hurricane footage alligator roam street ny follower florida wild ,,
10010,day hurricane pro tip buy your hurricane bread day moldy time hurricane arrives ,,
10011,live fthills lie lie area under water storm basically just get me few hr ago high wind sheet misty rain real rain here now should go until tomorrow mph storm my friend east need prayer ,,
10012,all animal start line up pair down my street ,,
10013,prayer everyone back home columbus county ilm ,,
10014,carl ford barbara jackson sign stand strong through tropical storm wind then stand strong hold public office vote carl ford senate vote barbara jackson nc supreme court ,,
10015,always feels good see roll white oak area evacuee transport more stable shelter thanks marine ,,
10016,nc dot currently land access into wilmington nc road close ,,
10017,get into place where hard get north carolina day help out victim please support mission click link below ,,
10018,mean somebody baby tool belt drive home guilt sorry hurricane fuck u up right now our bad ,,
10019,thank all help u set such great example u all ,,
10020,well school look good just some limb leave flooding see kid need play gym burning energy ,,
10021,why report hurricane bad than hugo wasn bad bad flood just rain before give me break ,,
10022,al still hasn verify video hour hurricane v normal men walk just wonderful time behind weather man hold ,,
10023,just check update tropical storm florence lot rain inch far localized flood power still my headache finally ,,
10024,ft hurricane florence ,,
10025,sign language interpret north carolina storm update thousand alum monica mcgee perform great service during florence hearing impair community ,,
10026,extensive flooding columbus cty slow restoration effort town like whiteville flood substation down transmission line priority right now also conduct damage assessment across county ,,
10027,due possible rise water high wind operate hr delay option close mon sept go ,,
10028,rather weather right now instead hurricane waxhaw north carolina ,,
10029,yall disrespect my wife give me during hurricane regard my foot beyond me ,,
10030,receive text our power restore monday afternoon customer never lose power thank local co op how corporation access my number ,,
10031,bruiser survive storm north carolina ,,
10032,mccoll sc flooding ,,
10033,flash flooding metropolitan charlotte remain hurricane florence via more inch rain fall since flash flooding continue ,,
10034,think lot last four day father because many your photo look skyward frantic scene newscast belie relentless rotation hurricane cloud deliberation tell below must accept whatever damage death storm brings ,,
10035,ppl post story flooding snapchat give me good update than news channel ,,
10036,massive sinkhole leave right before exit ,,
10037,thank our staff volunteer safely prepare our white flag guest relocate ,,
10038,north carolinian never take thing seriously ,,
10039,se ma trt set up new base ready deployment new area north carolina team drive through torrential rain new stag area ,,
10040,find person drive hour middle hurricane bring dinner then never let go ,,
10041,go say once life time flood situation county location identify shelter need decision open shelter make tonight ,,
10042,hey me soon hurricane finally leave steakhouse open up somewhere within mile ,,
10043,rain finally subside ,,
10044,only fayetteville see someone out canoeing hurricane ,,
10045,where lineman sleep after restore power thousand customer impact here sleep city each trailer hold lineman help get some rest ,,
10046,today extend forecast ,,
10047,wilmington fire department pray after loss mother month old baby both crush inside home fall tree ,,
10048,flood charlotte get bad think might almost over ,,
10049,sorry hurricane refugee couldn watch any game today happen gronk today jax cover him just one day ,,
10050,really see extent flooding cause hurricane florence drone footage downtown fayetteville north carolina today rain hard almost all day flooding only go get bad ,,
10051,random think rooftop escape mobile home case flood ,,
10052,lumber river fair bluff rise ft last hour town brace flood bad than matthew jody johnson ,,
10053,davidson county school close today due inclement weather flooding concern news viewer brandon benton post picture facebook photo show floodwaters behind denton elementary morning our crew spot water road ,,
10054,today tomorrow donate item take carolina bottle water cleaning supply diaper between wsb peachtree st care others brown mill road atlanta ,,
10055,miss my fianc much while im up carolina restore power ,,
10056,people need help heartwarming volunteer morning hurricane florence disaster relief drive happen now join american red cross south carolina ,,
10057,flood behind my place creek flow into morgan creek ,,
10058,updated statement say student absence excuse today durham parent complain student travel road flood tornado warning issue ,,
10059,when weather outside frightful good time stay inside work some sculpting ,,
10060,every little bit help people affect your donation enable prepare respond help people recover disaster ,,
10061,sum up our week far get cow ,,
10062,thankful everyone keep u prayer spar u school get cancel due some flood around city u thankfully venture ,,
10063,yadkin river donnaha hwy well out bank monday morning wake hurricane florence donnaha park ,,
10064,anticipate people didn order due hurricane come get need clean eatz greenville nc ,,
10065,fake road open now close due flood ,,
10066,keep your thought prayer move out recovery just begin please stay indoors flooding expect rise still need road clear first responder cargo district still close until further notice best ,,
10067,cancel class hurricane sun out ,,
10068,program get together demo chef michael greenville tech culinary institute carolina ,,
10069,last night more than people sought refuge more than red cross community shelter across impacted region help support red cross relief effort visit text florence make donation ,,
10070,well think make bad pass u now very grateful report shop good my sandbag hold many affect hurricane think ,,
10071,play network rely upon any emergency ,,
10072,take dog cat thing state fairground donate animal relocate coast north carolina state fairground ,,
10073,ice really use hurricane way detain innocent people fuck sick ,,
10074,glad just saw sun few minute rest eastern southern north carolina flood badly ,,
10075,close due flood near durham tech community college alt roxboro snow hl rd torredge rd ,,
10076,along neuse river downtown smithfield nc ,,
10077,hurricane flo officially pass outside our happy dance sun because our power back our damage minimal mail out three order brand new ,,
10078,hurricane florence fill lake overflow pump water out building basement flood tree fell into power line basement ok tree go power line fix class schedule tomorrow ready go ,,
10079,stun sight off hwy chesterfield county right down road north carolina border road border also wash out ,,
10080,thank best place work make sure all u employee affect hurricane florence help take care truly make all difference ,,
10081,thank all prayer thought all men other region affect our town down out take some time back well than ever ,,
10082,thank stand decency might add here link how folk help hurricane relief ,,
10083,think water go because hurricane ,,
10084,close flood alt durham chapel hill blvd old chapel hl rd both eb wb between farrington rd garrett rd ,,
10085,when last hurricane ,,
10086,when hurricane area local news get lose incredible coverage local reporter staff v natl team love twc watch local ppl cover florence awesome very heart hard work see how upset ,,
10087,shelter fayetteville nc damage hurricane florence need repair share legit around year great org my cat come many others use help too ,,
10088,san diego synagogue shoot dead injured ,,
10089,shoot report near san diego area synagogue ,,
10090,one dead several injure shoot san diego area synagogue ,,
10091,san diego synagogue shooter also sam hyde ,,
10092,other shooting ,,
10093,synagogue shoot california leaf least dead wound ,,
10094,one dead several injure southern california chabad synagogue ,,
10095,fatality hate crime mayor poway update shock detail synagogue shooting ,,
10096,dead suspect detain follow synagogue shoot poway ,,
10097,injury report after shoot california synagogue live update ,,
10098,man detain amp multiple injury report after shoot san diego synagogue ,,
10099,one dead synagogue shooting near san diego official say ,,
10100,sincere thank our great border patrol agent stop shooter synagogue poway california may off duty talent law enforcement weren ,,
10101,shoot san diego synagogue six month day shooting pittsburgh synagogue ,,
10102,condemn strong term evil amp cowardly shoot chabad poway today jewish family celebrate passover one should fear house worship antisemitism isn just wrong evil ,,
10103,john earnest suspect poway synagogue shoot ,,
10104,man whose name release use ar type assault weapon shoot worshipper chabad poway san diego county sheriff william gore tell reporter ,,
10105,police say synagogue suspect white male arm ar style semi automatic rifle ,,
10106,one dead three injure poway synagogue shoot ,,
10107,shoot san diego synagogue child among injured ,,
10108,multiple people gun down poway synagogue shooting ,,
10109,synagogue shoot leaf dead injure san diego county msn ,,
10110,year old man arm rifle open fire inside synagogue near san diego worshipper celebrate last day passover kill woman wound three people saturday ,,
10111,shoot chabad synagogue san diego kill one injure three denis poroy ,,
10112,thought prayer all affect shooting synagogue poway california god bless all suspect apprehend law enforcement outstanding job thank ,,
10113,shooting poway final day passover six month since murder tree life synagogue heartbreaking pray family victim entire jewish community today ,,
10114,poway synagogue shoot update one woman dead three injured year old white male suspect use ar type assault weapon custody rabbi among people shoot ,,
10115,today attack synagogue sandiego thing keep get bleaker even most progressive liberal state ,,
10116,people run everywhere dead wound passover shooting synagogue near san diego ,,
10117,man custody after shoot san diego area synagogue last day passover kill one injure three town mayor say ,,
10118,god bless fallen injure poway synagogue shoot such tragedy prayer ,,
10119,inside poway synagogue one guy shoot everybody cursing ,,
10120,several injure after gunman open fire san diego synagogue ,,
10121,another shooting synagogue time san diego ,,
10122,poway synagogue shooter typical republican poway synagogue shooter typical trump supporter poway synagogue shooter typical conservative want ,,
10123,four shot injure southern california chabad synagogue last day passover ,,
10124,another shooting place worship ,,
10125,poway synagogue shooter leave manifesto call president trump zionist anti white traitorous cksucker ,,
10126,multiple injure san diego synagogue shooting ,,
10127,break nbc san diego report off duty border patrol agent poway synagogue open fire suspect prevent attack significantly bad ,,
10128,one kill three injure attack poway synagogue police detain man question ,,
10129,one dead three injure synagogue shooting poway california ,,
10130,yet obama democrat control didn touch gun issue wonder why because lose issue happen poway nutcase shot people care more your agenda than people rather live dangerous freedom than peaceful slavery ,,
10131,trump respond poway synagogue shoot ,,
10132,border patrol agent shot gunman miss suspect himself then call law enforcement turn himself take into custody san diego police officer border patrol agent absolutely fuck all dumbass ,,
10133,injury report shoot california synagogue san diego sheriff ,,
10134,my heart go out all effect shooting synagogue poway california send my prayer victim friend amp family jewish community around world ,,
10135,break year old adult white male san diego suspected shooter california synagogue official say suspect flee scene then surrender police ,,
10136,san diego police hold press brief poway synagogue shoot ,,
10137,injure shoot san diego synagogue man detain police ,,
10138,synagogue shoot leaf dead wound poway near san diego cnn ,,
10139,how horrible praying because all sabbath last day passover shooter custody ,,
10140,break dead several injure jewish synagogue gunman wear bulletproof vest helmet open fire synagogue target rabbi child stop armed guard midway through service ,,
10141,goodbye jew ,,
10142,figure out why people anti mass shooting ,,
10143,poway synagogue shooter leave manifesto call president trump zionist anti white traitorous cksucker via ,,
10144,synagogue shoot near san diego leave dead injured year old arrest los angeles time ,,
10145,multiple people shoot attack poway synagogue police detain man question ,,
10146,dead injure shoot san diego synagogue during passover celebration ,,
10147,shoot report near san diego area synagogue ,,
10148,one dead several injure shoot san diego area synagogue ,,
10149,san diego synagogue shooter rumor white nationalist ,,
10150,time stop hate violence ,,
10151,synagogue shoot california leaf least dead wound ,,
10152,one dead several injure southern california chabad synagogue ,,
10153,fatality hate crime mayor poway update shock detail synagogue shooting ,,
10154,dead suspect detain follow synagogue shoot poway ,,
10155,injury report after shoot california synagogue live update ,,
10156,another shooting ,,
10157,man detain amp multiple injury report after shoot san diego synagogue ,,
10158,one dead synagogue shooting near san diego official say ,,
10159,sincere thank our great border patrol agent stop shooter synagogue poway california may off duty talent law enforcement weren ,,
10160,condemn strong term evil amp cowardly shoot chabad poway today jewish family celebrate passover one should fear house worship antisemitism isn just wrong evil ,,
10161,john earnest suspect poway synagogue shoot ,,
10162,gunman use ar type assault weapon shoot worshipper chabad poway san diego county sheriff william gore tell reporter ban assault weapon ,,
10163,police say synagogue suspect white male arm ar style semi automatic rifle ,,
10164,watch live watch special edition fox news update deadly shooting poway synagogue ,,
10165,one dead three injure poway synagogue shoot ,,
10166,poway synagogue shooter expressly hat jew love trump ,,
10167,shoot san diego synagogue child among injured ,,
10168,police detain man shoot synagogue san diego area ,,
10169,synagogue shoot leaf dead injure san diego county ,,
10170,year old man arm rifle open fire inside synagogue near san diego worshipper celebrate last day passover kill woman wound three people authority say ,,
10171,shoot chabad synagogue san diego kill one injure three denis poroy ,,
10172,thought prayer all affect shooting synagogue poway california god bless all suspect apprehend law enforcement outstanding job thank ,,
10173,hear shooting chabad poway thinking how thing affect just place attack entire jewish community month since attack my hometown last day passover love entire jewish community today always ,,
10174,again via ,,
10175,poway synagogue shoot update one woman dead three injured year old white male suspect use ar type assault weapon custody rabbi among people shoot ,,
10176,people run everywhere dead wound passover shooting synagogue near san diego ,,
10177,man custody after shoot san diego area synagogue last day passover kill one injure three town mayor say ,,
10178,inside poway synagogue one guy shoot everybody cursing ,,
10179,shooting chabad synagogue putin rabbi chbad community ,,
10180,several injure after gunman open fire san diego synagogue ,,
10181,four shot injure southern california chabad synagogue last day passover ,,
10182,poway synagogue shooter leave manifesto call president trump zionist anti white traitorous cksucker ,,
10183,multiple injure san diego synagogue shooting ,,
10184,break nbc san diego report off duty border patrol agent poway synagogue open fire suspect prevent attack significantly bad ,,
10185,one kill three injure attack poway synagogue police detain man question ,,
10186,one dead three injure synagogue shooting poway california ,,
10187,trump respond poway synagogue shoot ,,
10188,fox border patrol agent inside synagogue poway ca when yr old suspect start shoot border agent shot back save many individuales thank god border patrol agent ,,
10189,break year old adult white male san diego suspected shooter california synagogue official say suspect flee scene then surrender police ,,
10190,san diego police hold press brief poway synagogue shoot via ,,
10191,synagogue shoot leaf dead wound poway near san diego cnn ,,
10192,tl dead like people san diego synagogue ,,
10193,poway synagogue shooter leave manifesto call president trump zionist anti white traitorous cksucker via ,,
10194,synagogue shoot near san diego leave dead injured year old arrest los angeles time ,,
10195,dead injure shoot san diego synagogue during passover celebration ,,
10196,one dead several injure shoot san diego area synagogue ,,
10197,shoot synagogue outside san diego where worshipper celebrate last day passover send four people hospital ,,
10198,deadly shoot synagogue ,,
10199,last day passover hate must stop ,,
10200,synagogue shoot california leaf least dead wound ,,
10201,one dead several injure southern california chabad synagogue ,,
10202,fatality hate crime mayor poway update shock detail synagogue shooting ,,
10203,dead suspect detain follow synagogue shoot poway ,,
10204,injury report after shoot california synagogue live update ,,
10205,prayer poway ca synagogue shoot ,,
10206,another shooting place worship ,,
10207,man detain amp multiple injury report after shoot san diego synagogue ,,
10208,one dead synagogue shooting near san diego official say ,,
10209,sincere thank our great border patrol agent stop shooter synagogue poway california may off duty talent law enforcement weren ,,
10210,vp condemn strong term evil amp cowardly shoot chabad poway today jewish family celebrate passover one should fear house worship antisemitism isn just wrong evil ,,
10211,john earnest suspect poway synagogue shoot ,,
10212,also happen man whose name release use ar type assault weapon shoot worshipper chabad poway san diego county sheriff william gore tell reporter article say white male wrong very fine people trump ref ,,
10213,police say synagogue suspect white male arm ar style semi automatic rifle ,,
10214,one dead three injure poway synagogue shoot ,,
10215,why still happen sam zeif february ,,
10216,shoot san diego synagogue child among injured ,,
10217,police detain man shoot synagogue san diego area ,,
10218,synagogue shoot leaf dead injure san diego county ,,
10219,year old man arm rifle open fire inside synagogue near san diego worshipper celebrate last day passover kill woman wound three people saturday authority say ,,
10220,shoot chabad synagogue san diego kill one injures three ,,
10221,thought prayer all affect shooting synagogue poway california god bless all suspect apprehend law enforcement outstanding job thank ,,
10222,poway synagogue shoot update one woman kill three other people injured year old man custody suspect arm ar type assault weapon authority say ,,
10223,injury report after shoot california synagogue ,,
10224,people run everywhere dead wound passover shooting synagogue near san diego ,,
10225,horrible inside poway synagogue one guy shoot everybody cursing ,,
10226,shooting chabad poway ,,
10227,several injure after gunman open fire san diego synagogue ,,
10228,another mass shoot synagogue san diego ,,
10229,san diego shoot consider terrorist attack ,,
10230,prayer victim poway shoot ,,
10231,four shot injure southern california chabad synagogue last day passover ,,
10232,shoot poway synagogue terrorist attack ,,
10233,poway synagogue shooter leave manifesto call president trump zionist anti white traitorous cksucker ,,
10234,break nbc san diego report off duty border patrol agent poway synagogue open fire suspect prevent attack significantly bad ,,
10235,month day pittsburgh shooting ,,
10236,one kill three injure attack poway synagogue police detain man question ,,
10237,one dead three injure synagogue shooting poway california ,,
10238,trump respond poway synagogue shoot ,,
10239,year old adult white male san diego suspected shooter california synagogue official say suspect flee scene then surrender police ,,
10240,san diego police hold press brief poway synagogue shoot via ,,
10241,synagogue shoot leaf dead wound poway near san diego cnn ,,
10242,one dead mayor say ,,
10243,poway synagogue shooter leave manifesto call president trump zionist anti white traitorous cksucker via ,,
10244,synagogue shoot near san diego leave dead injured year old arrest los angeles time ,,
10245,shooting chabad poway synagogue today remember new york time promoted anti semitism week refuse apologize ,,
10246,dead injure shoot san diego synagogue during passover celebration ,,
10247,one dead several injure shoot san diego area synagogue ,,
10248,kill worshipper synagogue poway california ,,
10249,san diego synagogue shooter identify ,,
10250,shoot report poway synagogue gii ,,
10251,break shoot synagogue poway california ,,
10252,don understand much hate your heart ,,
10253,synagogue shoot california leaf least dead wound ,,
10254,one dead several injure southern california chabad synagogue ,,
10255,fatality hate crime mayor poway update shock detail synagogue shooting ,,
10256,dead suspect detain follow synagogue shoot poway ,,
10257,injury report after shoot california synagogue live update ,,
10258,man detain amp multiple injury report after shoot san diego synagogue ,,
10259,one dead synagogue shooting near san diego official say ,,
10260,sincere thank our great border patrol agent stop shooter synagogue poway california may off duty talent law enforcement weren ,,
10261,condemn strong term evil amp cowardly shoot chabad poway today jewish family celebrate passover one should fear house worship antisemitism isn just wrong evil ,,
10262,john earnest suspect poway synagogue shoot ,,
10263,police say synagogue suspect white male arm ar style semi automatic rifle ,,
10264,one dead three injure poway synagogue shoot ,,
10265,one dead three injure synagogue shooting poway california ,,
10266,shoot san diego synagogue child among injured ,,
10267,mayor dead injure passover hate crime ,,
10268,police detain man shoot synagogue san diego area ,,
10269,synagogue shoot leaf dead injure san diego county ,,
10270,year old man arm rifle open fire inside synagogue near san diego worshipper celebrate last day passover kill woman wound three people saturday authority say ,,
10271,shoot chabad synagogue san diego kill one injures three ,,
10272,thought prayer all affect shooting synagogue poway california god bless all suspect apprehend law enforcement outstanding job thank ,,
10273,elderly woman die fire saturday morning preliminary detail plane crash release person die after synagogue shooting ,,
10274,people run everywhere dead wound passover shooting synagogue near san diego ,,
10275,inside poway synagogue one guy shoot everybody cursing ,,
10276,several injure after gunman open fire san diego synagogue ,,
10277,four shot injure southern california chabad synagogue last day passover ,,
10278,poway synagogue shooter leave manifesto call president trump zionist anti white traitorous cksucker ,,
10279,break nbc san diego report off duty border patrol agent poway synagogue open fire suspect prevent attack significantly bad ht ,,
10280,one kill three injure attack poway synagogue police detain man question ,,
10281,one dead three injure synagogue shooting poway california ,,
