Medium	pagasa advisory red warning metro manila heavy intense rain next hr flood low lie area near river 
Medium	pagasa advisory red warning metro manila heavy intense rain next hr flood low lie area near river 
Medium	pagasa advisory red warning metro manila heavy intense rain next hr flood low lie area near 
Medium	pagasa advisory red warning metro manila heavy intense rain next hr flood 
Medium	flood alert san marcelino taft ayala manila passable all type vehicle via 
Medium	up campus diliman manila should open evacuation center family affect flood upm ds chair 
Medium	flood victim manila need soap pampers water hot food please open our malate branch http 
Medium	some good news person rescue tatalon qc 
Medium	flood harm animal just easily harm people place horse safer place amp take advantage money 
Medium	need rescue put white blanket roof house out your window rescuer see 
Medium	ngos amp charity organization accredit dswd pls consign your imported donation dswd 
Medium	ust hospital food shortage 
Medium	public service announcement gt pls fast response help way 
Medium	please ust hospital amp uerm medical center staff amp patient need food supply very low 
Medium	flood reach floor where nursery pls 
Medium	concepcion integrated school marikina family food yet whole day 
Medium	govph use government advisory rescue operation 
Medium	flood uerm hospital almost floor where nursery rescuer whole day 
Medium	urgent help need ust hospital flood reach building level 
Medium	please help ust uerm pgh hospital need 
Medium	please retweet ust hospital generator already die please send some rescuer 
Medium	ust hospital generator already die please send some rescuer 
Medium	ust hospital generator already die please send some rescuer 
Medium	ust hospital generator already die 
Medium	ust hospital generator already die please send some rescuer 
Medium	ust hospital uerm need immediate help ust morgue flood uerm nursery near flood please please 
Medium	hospital need help food amp water ust hospital uerm philippine general hospital pls 
Medium	ust hospital need help generator wont last long patient suffer 
Medium	hospital need help food amp water ust hospital uerm philippine general hospital 
Medium	contd house bungalow amp water knee deep already amp rise fast 
Medium	hospital ust uerm need urgent rescue because power generator stop anytime soon 
Medium	trinity university asia high school campus along rodriguez sr ave qc open evacuee donation please 
Medium	folk please tweet call rescue san juan cong agree field 
Medium	mayor jun binay also say also receive call rescue makati area via usec 
Medium	pls help people here tua high school along rod need food water clothes blanket pls 
Medium	more dried clothes blanket need holy family parish roxas district asap 
Medium	up pgh update want help pgh doctor nurse duty request food water via 
Medium	pgh emergency situation relief good accept distribution flood stricken area via 
Medium	mayor jun binay say report call rescue makati area via 
Medium	landslide manila suburb quezon city bury two house leave nine people dead four others injure 
Medium	ust hospital generator already die please send some rescuer 
Medium	please share list gov agency amp ngo 
Medium	need food water 
Medium	pls remember ateneo h kitchen cook food cook food item others like clothes med eat 
Medium	twitter account tweet directly faster rescue response pls avoid unnecessary traffic 
Medium	good bread amp bottle water need red cross san juan along santolan cor ortigas please help 
Medium	pagasa raise red warning again over metro manila 
Medium	cubao underpass now close traffic via 
Medium	just sad how my posting never get reply people volunteer my friend okay 
Medium	notice angat dam office please alert take necessary precaution 
Medium	act doh chief garin order transfer all pregnant woman evacuation center nearest govt hospital 
Medium	minor landslide san julian town eastern samar clear entire province without power ahead cong evardone 
Medium	typhoon hagupit evacuation step up 
Medium	bbc news typhoon evacuation step up 
Medium	typhoon hagupit trigger massive evacuation philippine 
Medium	typhoon hagupit ruby leyte image update folk ground via 
Medium	ready respond amp assist area affect arrange interview contact mimi maitem 
Medium	typhoon hagupit move towards landfall cnn andrew stevens report near tacloban philippine where 
Medium	strong wind typhoon ruby batter sorsogon get strong saturday afternoon 
Medium	world half million people evacuate coastal village typhoon hagupit head towards area 
Medium	how get involved fluent language philippine help recent typhoon recovery 
Medium	philippine typhoon hagupit evacuation step up 
Medium	typhoon hagupit trigger massive evacuation philippine 
Medium	video tacloban today help community prepare super wind strong 
Medium	typhoon hagupit threaten philippine include flash player installation 
Medium	more than flee typhoon blow near eastern philippine military full alert 
Medium	don say filipinos flee typhoon blow near manila philippine ap haunt typhoon hai 
Medium	adminstration step up evacution approach watch more insight asia 
Medium	more globe signal eastern samar gt gt globe fall 
Medium	typhoon hagupit evacuation step up 
Medium	more than flee typhoon nears philippine 
Medium	typhoon hagupit evacuation step up 
Medium	evacuation gather pace nears people live along coast central 
Medium	hagupit garin move transfer pregnant evacuee hospital act health secretary 
Medium	typhoon hagupit evacuation step up 
Medium	massive evacuation typhoon hagupit near philippine 
Medium	thousand flee hagupit nears philippine 
Medium	partylist urge activate free mobile disaster alert law amidst hagupit via 
Medium	massive evacuation typhoon hagupit near philippine manila reuters more than half million people 
Medium	typhoon hagupit evacuation step up 
Medium	hagupit garin move transfer pregnant evacuee hospital 
Medium	lmpe over evacuate typhoon hagupit near philippine typhoon hagupit expect hit eastern sama 
Medium	massive evacuation typhoon hagupit nears philippine rosemarie francisco manila reuters more than 
Medium	typhoon hagupit evacuation step up 
Medium	massive evacuation typhoon hagupit near philippine 
Medium	massive evacuation typhoon hagupit near philippine 
Medium	more than flee typhoon nears philippine 
Medium	massive evacuation hagupit nears philippine 
Medium	massive evacuation typhoon hagupit near philippine manila reuters more than half 
Medium	more than flee blow near eastern military full alert 
Medium	philippine typhoon hagupit update evacuate storm approach 
Medium	massive evacuation typhoon nears philippine 
Medium	typhoon hagupit tacloban guiuan evacuation center share linkname typhoon hagup 
Medium	typhoon hagupit evacuation step up 
Medium	typhoon hagupit evacuation step up 
Medium	typhoon hagupit evacuation step up 
Medium	philippine typhoon hagupit update evacuate storm approach all flight 
Medium	massive evacuation typhoon nears philippine rosemarie francisco manila reuters more tha 
Medium	typhoon hagupit more than half million philippine resident flee storm surge world news via 
Medium	philippine typhoon hagupit evacuation step up bbc news 
Medium	philippine thousand flee typhoon hagupi near hindustan time 
Medium	bbc news philippine typhoon hagupit evacuation step up 
Medium	typhoon hagupit evacuation step up 
Medium	more than flee typhoon nears philippine 
Medium	hundred thousand evacuate philippine typhoon hagupit near new york time 
Medium	massive evacuation typhoon nears dec et 
Medium	flee philippine village brace typhoon hagupit 
Medium	philippine typhoon hagupit evacuation step up 
Medium	typhoon hagupit evacuation step up 
Medium	hundred thousand evacuate philippine typhoon hagupit nears 
Medium	major evacuation philippine brace typhoon hagupit more than half million people seek safety ty 
Medium	hundred thousand flee home philippine typoon hagupit draw near 
Medium	massive evacuation typhoon nears philippines more than half million people philippine flee 
Medium	philippine more than evacuate country large peacetime evacuation storm approach 
Medium	massive evacuation typhoon hagupit near philippines more than half million people philippine 
Medium	typhoon hagupit evacuation step up 
Medium	hundred thousand evacuate philippine typhoon hagupit nears 
Medium	typhoon hagupit evacuation step up 
Medium	hundred thousand evacuate philippine typhoon hagupit nears 
Medium	super typhoon hagupit flee storm approach 
Medium	philippine brace arrival typhoon hagupit new york time 
Medium	typhoon hagupit evacuation step up get closer 
Medium	more than flee typhoon nears philippine 
Medium	massive evacuation typhoon nears philippine 
Medium	typhoon hagupit evacuation step up 
Medium	massive evacuation typhoon nears philippine 
Medium	massive evacuation typhoon hagupit near philippine 
Medium	typhoon hagupit evacuation step up 
Medium	philippine shift disaster response typhoon approach 
Medium	typhoon hagupit trigger massive evacuation 
Medium	filipinos flee typhoon hagupit blow near more than people 
Medium	super typhoon hagupit flee storm approach 
Medium	people flee philippine village country brace itself typhoon hagupit hit 
Medium	massive evacuation typhoon nears philippines manila reuters more 
Medium	philippine thousand flee typhoon hagupi near hindustan time 
Medium	typhoon hagupit evacuation step up 
Medium	massive evacuation typhoon nears philippine tribune wire report via news chicago tribune 
Medium	typhoon hagupit evacuation step up come tomorrow help u crisis map region aid agency 
Medium	mass evacuation typhoon blow near eastern philippine 
Medium	filipinos flee typhoon blow near via 
Medium	hundred thousand flee home philippine typoon hagupit draw near via 
Medium	bbc news philippine typhoon hagupit evacuation step up 
Medium	typhoon hagupit evacuation step up 
Medium	massive evacuation typhoon hagupit near philippine 
Medium	update december source pagasa 
Medium	thousand flee hagupit near philippine evacuate coastal area already devastate typhoo 
Medium	more than flee typhoon nears philippine 
Medium	smart grid super typhoon hagupit hit eastern philippine flee 
Medium	super typhoon lash philippine flee super typhoon hagupit begin lash eastern 
Medium	current info typhoon ruby hagupit 
Medium	alert editor note typhoon hagupit just recently make landfall eastern philippine report yet solidify 
Medium	saturday afternoon expect strong wind storm surge meter note storm signal pix 
Medium	philippine typhoon hagupit evacuation step up news financial express adesh via 
Medium	super typhoon lash philippine flee super typhoon hagupit begin lash eastern philip 
Medium	due slow movement area experience extreme weather long duration increase damage impact 
Medium	over people shelter enters city tonight half city population 
Medium	philippine brace destruction typhoon near more than half million people philippine 
Medium	prepares respond ppl emergency essential family amp hygiene kit food amp emergency item 
Medium	help move food disaster area bring extra rice life save biscuit 
Medium	typhoon ruby hagupit move towards island province masbate where estimate make second 
Medium	philippine forecaster say typhoon hagupit slam into eastern coast abc news 
Medium	world vision prepare respond people emergency essential get involve help here 
Medium	typhoon hagupit make landfall philippine million flee 
Medium	prepares relief commits initial relief effort 
Medium	typhoon hagupit begin agonizingly post service 
Medium	still stall move slow 
Medium	news philippine sitrep re preparedness measure typhoon ruby hagupit 
Medium	bbc news philippinen typhoon hagupit make landfall thousand flee 
Medium	flight cancel airport shut down due ruby hagupit 
Medium	typhoon hagupit landfall philippine mile tacloban hit last year super typhoon 
Medium	philippine typhoon make landfall powerful typhoon hagupit make landfall philippine where over 
Medium	typhoon hagupit make landfall philippine more than half million people evacuate 
Medium	typhoon associate storm surge up meter make landfall 
Medium	philippine sitrep re preparedness measure typhoon ruby hagupit 
Medium	ca tc canada ready help philippine typhoon impact need oliver 
Medium	unicef ready respond aftermath super typhoon hagupit 
Medium	high storm surge explain pagsa gov wx svc full moon high tide expect surge make big wave 
Medium	church frontline typhoon hagupit batter philippines independent catholic news 
Medium	two people confirm dead hit philippine east typhoon predict track west towards manila 
Medium	canada ready help philippine typhoon impact need oliver national newswatch 
Medium	landfall vicinity masbate associate strong wind storm surge up meter heavy torrential rainfall 
Medium	canada help philippine typhoon impact need oliver 
Medium	philippine typhoon aid watch 
Medium	major typhoon hagupit hit philippine destruction power flood see description update 
Medium	new video church school take typhoon hagupit evacuee 
Medium	bbc typhoon hagupit key fact figure 
Medium	powerful typhoon slam into eastern philippine 
Medium	pagasa weather forecaster aldczar aurelio expect weaken interact land 
Medium	minister oliver affirm canadian support philippine preparation typhoon hagupit 
Medium	thank lord mayor alfred romualdez tacloban far zero casualty tayo rito 
Medium	ll know more tonight tomorrow begin collect donation now our blog post update here 
Medium	ph army should also aware happen now our country stay safe 
Medium	canada help philippine typhoon impact need oliver 
Medium	video tacloban feel full fury hagupit just before midnight sunday 
Medium	typhoon hagupit destroy home wind tear across philippine 
Medium	roof tear off building damage fall tree otherwise bad expect 
Medium	typhoon tear down home disaster weary philippines rakyat post 
Medium	hagupit tear down home disaster weary philippine 
Medium	sun daily typhoon tear down home disaster weary philippine lt strong gt legaspi lt strong gt typhoon hagu 
Medium	typhoon tear down home disaster weary philippine 
Medium	typhoon damage assessment begin philippines voice america 
Medium	hagupit tear down home disaster weary philippine 
Medium	typhoon hagupit update typhoon hagupit make landfall slam philippine video watch 
Medium	habitat humanity launch appeal assist affect typhoon hagupit 
Medium	get interview 
Medium	video typhoon tear into disaster weary philippine via 
Medium	typhoon tear down home disaster weary philippine 
Medium	typhoon tear down home disaster weary philippine 
Medium	habitat humanity launch appeal assist affect typhoon hagupit via 
Medium	damage city early impression gov prepared already clean up 
Medium	philippine prepare typhoon say aid worker 
Medium	singapore move assure manila relief help typhoon nears 
Medium	habitat humanity launch appeal assist affect typhoon hagupit 
Medium	talk iloilo governor arthur defensor one death iloilo say relate 
Medium	christ king college now after massive attack rosalado abarquez rey anthony 
Medium	massive damage city tacloban philippine photo take 
Medium	typhoon hagupit update typhoon hagupit down tree knock out power hagupit typhoon watch 
Medium	each food pack contain kilo rice sardine pack noodle sachet instant coffee via 
Medium	hurricane ctags 
Medium	two even too many 
Medium	more fund raise more family help 
Medium	palace well prepare time 
Medium	swim white beach boracay 
Medium	dbm release billion quick response fund disaster relief assistance include hagupit 
Medium	last year find crisis response need gender sensitive hope re implement during 
Medium	some tip keep mind prepare 
Medium	dbm release billion quick response fund disaster relief assistance include hagupit 
Medium	new drop off point donation salamat kapamilya 
Medium	pagasa occasional rain expect metro manila tonight 
Medium	interaksyon kumusta tacloban casualty report after eastern samar landfall hagupit 
Medium	country pledge aid ruby batter ph manila philippine amp typhoon ruby 
Medium	citizen help document onslaught via ab cbn 
Medium	office vice president stc loc vp stc pursuant 
Medium	habitat humanity launch appeal assist affect typhoon hagupit 
Medium	bookmark page list class suspension december via 
Medium	country move assist typhoon hit ph then steal crook 
Medium	habitat humanity launch appeal assist affect typhoon hagupit 
Medium	some family now gather evac center manila baseco neighborhood near water 
Medium	click kph blog amp map site 
Medium	broken glass litter street after pose threat pedestrian motorist 
Medium	country pledge aid philippine ruby disaster relief mission sun star via 
Medium	western visayas pdrrmc confirm die due ty hypothermia eclampsia 
Medium	typhoon hagupit strike same ravage area philippine philippine gawad kalinga usa set up effort 
Medium	wind lash philippine typhoon hit watch 
Medium	san remigio per brgy capt segarino some light material house near shoreline brgy tambongon damage big wave 
Medium	major damage ruby weaken legazpi philippine typhoon ruby hagupit knock out 
Medium	begin wreak damage bayanihan alay sa sambayanan balsa call all monitor prepare help any way 
Medium	lgu distribute relief good evacuee tacloban astrodome courtesy 
Medium	your smartphone save your life way extend smartphone battery life during disaster 
Medium	lakas maka pr shet cpp mobilize npa help hit area 
Medium	fall tree along nat highway calbayog during lull typhoon via 
Medium	dswd send more relief hit area 
Medium	trend philippine pm pht 
Medium	quezon province pio evacuee person family scatter evacuation center 
Medium	cleanup begin part philippine typhoon hagupit head northwest wall street journal wall street 
Medium	tweet picture timeline typhoon 
Medium	cebu city say some city employee deploy help clean evac center esp school tom 
Medium	casualty record all province bicol sunday afternoon authority say 
Medium	troop roll out survey damage 
Medium	video hagupit weaken make landfall over masbate may exit par wednesday morning 
Medium	hi ground tacolban collect pic vids content typhoon get touch 
Medium	trend philippine pm pht 
Medium	trend philippine pm pht 
Medium	lifeliners work oplan kapit bisig planning relief operation after re sure many would 
Medium	philippine habitat humanity launch appeal assist affect typhoon hagupi 
Medium	amp philippine disaster relief donate world vision canada via 
Medium	photo take stock damage 
Medium	albeit city relatively safe typhoon ruby hagupit still under signal still class 
Medium	kumusta tacloban casualty report after eastern samar landfall hagupit 
Medium	ceo brutal dangerous storm prepare absolute bad 
Medium	country pledge aid philippines 
Medium	dumaguete really lucky right now wind rain storm just hop everyone affect stay safe 
Medium	yes require use 
Medium	update water amp hygiene kit water tank salt generator etc now en route give relief 
Medium	evacuation center housing person say provincial administrator jose tamayo 
Medium	hagupit threaten flood landslide 
Medium	tacloban philippine cnn when harry return 
Medium	photo more than individual now diff evacuation cntr town albay apsemo courtesy 
Medium	palo leyte lead clear ops 
Medium	flooding landslide threat typhoon hagupit thrash philippine torrential rain also thr 
Medium	typhoon cleanup begin part philippine 
Medium	still wait typhoon completely pass our area tweet roxas city 
Medium	flooding landslide threat typhoon hagupit thrash philippine torrential rain also thr 
Medium	pagasa light moderate rain affect quezon portion batangas cavite may persist 
Medium	hit 
Medium	strong wave crash into coastal house typhoon hagupit pound legazpi albay ap stay safe my bicolano friend 
Medium	still class tomorrow 
Medium	country pledge aid philippines 
Medium	today family person evacuate area affect 
Medium	kit water tank salt generator etc now en relief fm 
Medium	trend philippine pm pht 
Medium	just head usec pama confirm two casualty aftermath 
Medium	year old woman drown flood catarman northern samar due 
Medium	mayor christopher gonzales say death guiuan eastern samar after onslaught typhoon ruby sustain minor injury 
Medium	just case need help keep number 
Medium	food truck satphones wfp provide whatever need help people 
Medium	resident take shelter pope francis complex 
Medium	truck sat phone wfp provide whatever ppl 
Medium	wfp provide transport food philippines government typhoon response 
Medium	work prepare community respond emergency like donate our work today 
Medium	final tally evacuee city naga 
Medium	ndrrmc confirm two death due 
Medium	provide food transport 
Medium	provide food transport 
Medium	my christmas gift everyone free live streaming update ruby hagupit 
Medium	raw typhoon hit philippine watch 
Medium	leaf two person dead iloilo 
Medium	today begin distribution emergency essential family 
Medium	add video playlist typhoon ruby hagupit update after landfall 
Medium	video euronews more than million take shelter typhoon hagupit hit philippine least two peopl 
Medium	icymi chief usec alex pama confirm typhoon casualty iloilo both suffer hypothermia 
Medium	gov firmalo far evacuee already more than evacuation center romblon via 
Medium	disaster relief equipment all ready read 
Medium	re distribute emergency aid water hygiene kit today affected family 
Medium	during amp re ready now help u 
Medium	food truck satphones wfp provide whatever need help people 
Medium	lot light material home destroy along northern area jim linton via greg iaru 
Medium	news calbayog samar first casualty old confirm dead after get crush uprooted tree 
Medium	deploy disaster monitor amp coordinate local govt amp humanitarian orb 
Medium	trend philippine pm pht 
Medium	nearly evacuation center after landfall 
Medium	rainfall threat previous record mm hr ondoy break record hrs ruby forecast mm hr 
Medium	nearly evacuation center after landfall 
Medium	long stay typhoon rappler report leyte 
Medium	remember important hotlines during emergency amp calamity share friend family 
Medium	tacloban airport open military general aviation flight relief effort only until december 
Medium	warn upd msg typhoon hagupit nw pacific ocean wind kt gust kt report jtwc 
Medium	know any road impassable due let u know help guide relief convoy 
Medium	path storm most building flatten please build good house 
Medium	distribute emergency aid water hygiene affected family pi 
Medium	china offer assistance typhoon hit philippine 
Medium	gov office ncr region amp per deputy presidential spokesperson keep safe everyone 
Medium	typhoon hagupit powerful picture show extent storm devastation 
Medium	weather satellite feed dec via 
Medium	keep safe everyone 
Medium	news landslide fear typhoon lash philippines usa today 
Medium	philippine case study 
Medium	rain only strong breeze hope best stay safe everybody 
Medium	news bus wish get over need bit slack 
Medium	happy house damage zero casualty catarman via 
Medium	video kitten find joplin missouri tornado debris 
Medium	cardinal news card royal series benefit tornado victim 
Medium	thx former lady tiger wnba guard temeka johnson contribute tornado relief 
Medium	city may offer loan tornado damage matt garfield staff writer raleigh resident struggle 
Medium	connecticut resident help tornado response 
Medium	old rock house donate heart missouri united way joplin tornado relief every time re tweet 
Medium	president obama visit tornado ravage joplin missouri speak survivor memorial service 
Medium	tornado warning 
Medium	royal lay out plan tornado relief royal lay out plan tornado relief 
Medium	dog suck up tornado crawl home two broken leg via 
Medium	facebook twiiter step help joplin tornado victim international business time 
Medium	more than raise just over four day relief north givemn org 
Medium	before after photo wow 
Medium	incredible image massachusetts tornado space 
Medium	cardinal news card royal series benefit tornado victim 
Medium	break news stream ktvi fox coverage st louis tornado live our weather blog e 
Medium	resident need repair after reach landlord 
Medium	new event tornado warn pm pm cdt barton county dade coun read more http 
Medium	show new shelter resident 
Medium	break all damage survey tornado location nws concludes torn cont 
Medium	scary terrify mo before after 
Medium	research phase array radar capture long lived tornado may read here 
Medium	ok under official tornado watch until later morning please keep u your thought prayer just come over scanner 
Medium	president obama visit tornado ravage joplin missouri speak survivor memorial service 
Medium	canine team continue search today wsj article new photo 
Medium	two hook one near dallas one near one west arlington tx 
Medium	tour twister ravage neighborhood 
Medium	watch tornado springfield 
Medium	week after tornado people miss 
Medium	tornado report gound near ramona sd heading northeast 
Medium	connecticut resident help tornado response 
Medium	old rock house donate heart missouri united way joplin tornado relief every time re tweet 
Medium	tornado watch new york city know anyone deaf hard hearing physically disabled reach out make sure 
Medium	thx former lady tiger wnba guard temeka johnson contribute tornado relief 
Medium	city may offer loan tornado damage matt garfield staff writer raleigh resident struggle 
Medium	video violent tornado catch film least four people die after tornado rip through u stat 
Medium	nat weather service westfield springfield monson tornado minimum hardest hit area 
Medium	watch until mi nw oh until edt 
Medium	ap video obama speak memorial service tornado victim joplin mo one strange cj 
Medium	facebook twiiter step help joplin tornado victim international business time 
Medium	more than raise just over four day relief north givemn org 
Medium	spc tornado watch status report 
Medium	mash unit set up mo 
Medium	video kitten find joplin missouri tornado debris 
