Medium	paris shooting explosion near stade de france kill bbc news 
Medium	report say hostage tweet help execution occur war 
Medium	stop posting picture paris police ask because show police position pas 
Medium	paris attack facebook put safety check feature into action facebook activate sa 
Medium	concertgoer escape just bullet begin fly paris attack zsuzsa kover narrowly escape take ho 
Medium	paris attack might mean future europe border 
Medium	german official investigate arrested man over paris attack 
Medium	paris attack report killed hostage situation ongoing 
Medium	german medium report arrest bavaria tie paris attack police decline confirm link 
Medium	wall street journal paris attack suggest shift islamic state 
Medium	people tell stay inside police comb trendy area paris where attack take place 
Medium	cnn newday isi claim responsibility paris attack watch coverage 
Medium	philippine vow high apec summit security after paris attack 
Medium	ap blog frequent update former u official say paris attack unclear http 
Medium	french connection knock effect paris attack follow kevinfitts 
Medium	video bbc news coverage paris attack bbc news coverage follow report many people kill 
Medium	jum break syrian passport find body one suicide bomber paris stadium 
Medium	police storm concert hall where hostage hold attacker shout allahu akbar fire into crowd witness say 
Medium	paris attack almost even bad suicide bomber stop enter stade de france last night 
Medium	dramatic video photo paris attack share social medium 
Medium	germany may foil plot supply arm paris attacker 
Medium	paris attack know don know brief late information 
Medium	neibourhood block police now 
Medium	video attack word 
Medium	drill paris attack drill multi attack site exercise run morning attack 
Medium	cameron shock paris attack 
Medium	amp cnn air report man inside via fb scene carnage body everywhere capacity venue 
Medium	germany squad evacuate paris hotel ahead france friendly due bomb threat 
Medium	paris attack hostages take death toll climb via 
Medium	cnn cnn producer pierre buet describe saw after hostage escape 
Medium	french police ban all public demonstration paris until thursday follow 
Medium	hostage situation multiple casualty report after shooting explosion rock paris least people 
Medium	paris attack one gunman french extremist know police live 
Medium	paris attack paris mayor address medium new york time 
Medium	paris attack people clamber out bataclan concert hall escape gunfire video 
Medium	nicola sturgeon chair security summit wake paris attack nicola sturgeon chair meeting 
Medium	spread word french police say dont tweet picture because show position where 
Medium	ukip warn border less europe increase risk harm aftermath paris attack hartlepool gathering hold 
Medium	stop posting picture paris police ask because show police position pas 
Medium	least report dead hostage take paris attack via app 
Medium	three eight paris attacker come france brussels 
Medium	police official syrian passport find body suicide bomber paris stadium 
Medium	paris attack live stream video via 
Medium	paris attack trigger border crackdown airport chaos 
Medium	happen each location paris attack 
Medium	video watch bomb detonates during football match string paris terror attack via 
Medium	bombshell massive drill same day paris attack 
Medium	paris attack safe travel paris follow series coordinated terror attack across paris 
Medium	break french security force take decisive action follow bad paris attack since ww ii 
Medium	belgium justice minister number arrest make brussels relate paris attack via 
Medium	paris attack similar mumbai assault expert horrific terrorist attack paris describe 
Medium	paris attacker blame french military action syria witness 
Medium	more update french police least dead paris attack hostages take via theob 
Medium	isi supporter celebrate paris attack conservative war hawk call action 
Medium	facebook activate safety status tool after deadly paris attack social network safety check tool de 
Medium	police union official tell ap suicide attack one bombing near stadium 
Medium	attack least people hold hostage inside paris concert hall police say 
Medium	marketwatch say wall street journal paris attack kill more than seemingly coordinate terror 
Medium	attn tweet post picture paris give away police position already word 
Medium	survivor reveal harrow detail paris attack 
Medium	death toll paris attack exceed prosecutor say 
Medium	french medium report one bomber french bear near paris another female 
Medium	isi celebrate paris attack twitter hashtag massive operation grace allah above power 
Medium	german police intercept car eight ak grenade tnt paris program into satnav 
Medium	video capture explosion during paris football match stade de france chill footage emerge 
Medium	conservativecch itvnews attack retaliation target strike militant jihadi john anti 
Medium	paris attack push facebook twitter user new tool wsj 
Medium	victim bloody floor after terrorist attack paris batacla via 
Medium	cia director meet french security chief mossad before paris attack 
Medium	retweeted abc news late ongoing situation paris many hostage hold 
Medium	belgian raid ongoing after paris attack rental car link trio detain 
Medium	least dead after shootings explosion paris afp say via 
Medium	german police detain man connect paris terror group one week ago weapon stil attack happen 
Medium	sport event league increase security wake paris attack wake terrorist attack paris sport league 
Medium	police activity report hotel pullman paris france where police apparently search hotel 
Medium	explosion paris near stade de france conversely dead wound shoot incident 
Medium	stun europe step up security follow paris attack rome ap soldier paramilitary troop tot 
Medium	uwm professor others confine pub after paris attack 
Medium	terrify eyewitness account survior paris bataclan attack via 
Medium	photo police firefighter scene shoot paris 
Medium	all paris attacker dead associated press report head paris police say all attacker believe dead 
Medium	detail emerge gunman behind deadly paris shooting bombing attack 
Medium	claim responsibility attack call miracle 
Medium	champ de mar underground station central paris close police stati 
Medium	paris attack facebook put safety check feature into action facebook activate 
Medium	paris attack explosion sound during ger v fra match sjz 
Medium	paris attack why france target again 
Medium	paris attack three team involve prosecutor molins 
Medium	paris attack four important lesson world must learn french tragedy foxnews bolton excellent assessment 
Medium	mobile phone save man life during paris attack man claim mo ff 
Medium	exclusive paris attack plan isi control territory 
Medium	isi claim responsibility paris attack france vow ruthless response 
Medium	ap say hostage situation end carnage inside 
Medium	investigator use fingerprint id one paris attacker french national know police source tell cnn 
Medium	paris attack video appear show moment explosion hear stade de france 
Medium	bbc news paris attack dead hostage take bataclan art centre 
Medium	explosion heard paris soccer game espn deport footage explosion hear during fran 
Medium	bernard kerik paris attack highlight intelligence failure extremely concern 
Medium	paris attacks german official investigate man arrest last week international business time 
Medium	use facebook say re safe during event like paris attack 
Medium	late police say suicide bomber syrian passport paris ap late shooting 
Medium	stop tweet pic paris bc show police position stop tweet pic paris bc show police position stop tweet pic 
Medium	arrest tie paris attack belguim authority conduct raid after trace license plate mystery car see 
Medium	isi claim credit paris attack france vow merciless response via 
Medium	terrorist detonate suicide bomb horrific paris attack official say 
Medium	police raid brussels neighbourhood link paris attack belgian tv brussels afp belgian 
Medium	social medium rumour paris attack shouldn believe buzzfeed news 
Medium	victim treat since day state absolute emergency witness amp relative also 
Medium	dead after siege bataclan concert hall attack across paris live 
Medium	late death toll rise triple paris attack french medium report 
Medium	cia director brennan meet french secuity chief one week before paris attack report clg news 
Medium	site terror where paris attack happen 
Medium	predict paris attack two year ago say tb joshua facebook post saturday th 
Medium	amid bataclan hostage crisis paris police wait too long rescue victim via 
Medium	report suspect custody allegedly help dzhokhar tsarnaev after bomb via 
Medium	three more arrest make boston marathon bomb photo 
Medium	fbi update investigation into multiple explosion boston 
Medium	boston bomb suspect walking 
Medium	horrible news boston marathon live feed fox news show spectator say say dead body 
Medium	entire copley square area evacuate move clarendon street 
Medium	break explosion report near boston marathon finish line cnn affiliate wcvb report 
Medium	all concern loved one see where last check here 
Medium	pic sure doesn look good aftermath boston marathon bombing via 
Medium	follow live coverage aftermath two explosion finish line boston marathon 
Medium	watch live two explosion near finish line boston marathon leave unknown number people injured 
Medium	two blast marathon injure least people some seriously situation still develop 
Medium	former lapd chief william bratton live nbc news right now say one source estimat 
Medium	new york city tighten security wake explosion marathon don know extent casualty http 
Medium	boston authority ask people limit cell phone use system overload 
Medium	boston pd cnn injured death explosion 
Medium	two explosion near finish line boston marathon 
Medium	boston pd say get social medium tell people stay away boston marathon area jfk libra 
Medium	awful scene sad life lose 
Medium	thought go out boston 
Medium	explosion report boston marathon finish line spread word 
Medium	here wikipedia article track go development 
Medium	official investigate boston marathon explosion report find believe unexploded device 
Medium	info look someone please visit person finder add data ht 
Medium	comm warn people cautious hold another press conference central 
Medium	explosion boston marathon authority request texting only keep phone line open pra 
Medium	break boston pd report injury death marathon explosion report say police still find second 
Medium	sometimes people really suck love boston my hometown bomb finish 
Medium	pres obama receive update fbi director blast credit pete souza white house http 
Medium	terrify 
Medium	try find loved one boston call any info explosion call 
Medium	american red cross statement boston marathon explosion 
Medium	heart wrench photo photo bystander comfort victim today attack boston 
Medium	pt pres obama address nation explosion ll livestreaming here http 
Medium	country represent boston marathon today attack world just boston just 
Medium	most inspiring story runner finish mile then run over mass general ho 
Medium	explosion report near boston marathon finish line cnn affiliate wcvb report 
Medium	president obama find out hold accountable 
Medium	security beef up worldwide after multiple boston blast police los angeles new york city london ot 
Medium	close my eye amp see well day close my eye amp pray don want live here anymore 
Medium	two soldier didn need tell help after run marathon http 
Medium	don scroll 
Medium	boston marathon explosion reportedly injure dozen live update 
Medium	boston police least people kill boston marathon bombing 
Medium	video interview bill iffrig year old man orange knock down blast boston marathon http 
Medium	photo copsandrobert weird happening two day ago page create facebook boston marathon 
Medium	least injured boston bombing critical condition some expect survive night 
Medium	everyone pray people boston tragic event one deserve pray all 
Medium	marathon carnage explosion boston via 
Medium	injury marathon terror attack now critical least injure child 
Medium	obama travel boston thursday attend interfaith service marathon bombing victim via 
Medium	saudi man injure bomb boston saudi man call terrorist suspect saudi man find witness 
Medium	break news official possible boston marathon bomb suspect see image second bomb site 
Medium	report substantial progress marathon bombing case 
Medium	accord arrest bombing imminent already take place 
Medium	boston police despite report contrary arrest marathon attack 
Medium	international herald tribune video point suspect marathon bombing 
Medium	happen president obama speaks interfaith service dedicate victim bombing boston 
Medium	obama attend boston bomb service president obama attend service boston victim monday maratho 
Medium	krachtige reddit community op boston reddit help solve boston bombing merely accuse innocent people 
Medium	first time police confirm scanner marathon bombing suspect 
Medium	one boston bombing suspect presume dead other still large catch bitch 
Medium	exclusive boston bomb victim iconic photo help fbi identify attacker 
Medium	police search white capped marathon bomb suspect loose after shoot carjack htt 
Medium	break survive boston bomb suspect idd dzokhar tsarnaev living cambridge mass one year 
Medium	boston marathon bomb suspect kill another large 
Medium	terroristic threat boston bomb suspect dad tell son surrender say all hell break loose son dy http 
Medium	uncle marathon bombing suspect speak 
Medium	video cnn empty boston though bomb drop oh 
Medium	stay indoors order lift even though dzhokhar tsarnaev hasn capture point instit 
Medium	break good shot boat where suspected bomber hide out 
Medium	break news three people take into custody new bedford part boston marathon terror bomb investigation 
Medium	state official tsarnaev alive conscious capture 
Medium	boston police second suspect week boston marathon bombing custody after extensive manhunt cnn 
Medium	boston marathon suspect custody boston police say 
Medium	fbi release photo boston marathon bomber suspect 
Medium	kremlin say agree step up counter terrorism co operation follow bombing 
Medium	report saudi national dhs file say individual link boston bombing via 
Medium	zooey deschanel boston bombing suspect accord fox news photo 
Medium	boston bomb suspect probed link extremist group tv via 
Medium	bombing suspect boston plan more attack 
Medium	new picture purport show tsarnaev brother engage firefight police 
Medium	boston bomb incredible picture emerge suspect street gun battle police boston bo via 
Medium	break source marathon bomb suspect admit brother detonate bomb kill police officer 
Medium	orlando man kill fbi tie boston marathon bomb suspect nbc news confirms 
Medium	friend boston bomb suspect shot kill fbi agent report 
Medium	october source info amp chronological reference leading free community service 
Medium	total fire ban declare great sydney region sunday october between 
Medium	fire danger update tomorrow sign very high southern range region permit suspend 
Medium	grow fire near norwest hospital nsw fire brigade attendance 
Medium	relief crew arrive re now head back station coach long day good luck night crew 
Medium	total fire ban place number area tomorrow include great sydney great hunter illawarra 
Medium	hot dry windy condition over much nsw please take care observe total fire ban apply htt 
Medium	high fire alert tomorrow hit temp strong wind create severe fire danger 
Medium	fire nsw uncontained today challenge hot windy stay up date 
Medium	fire fire jump bell line road 
Medium	nsw highway close both direction wilton hume mwy picton rd bush fire start today last 
Medium	newcastle airport close due smoke bushfire williamtown 
Medium	trouble rfs website check 
Medium	linksview rd fire cross nepean river burn castlereagh penrith area 
Medium	view springwood fire look toward winmalee warrimoo oval 
Medium	use our interactive map explore current incident warning nsw 
Medium	mirror bushfire map here fb update 
Medium	nina aka spare outside our house parramatta amaze 
Medium	commissioner shane fitzsimmons get through less than home destroy today lucky 
Medium	chain valley bay fire hit residential area via paige thomas 
Medium	please call triple zero just report smoke save people need emergency 
Medium	raymond terrace newcastle airport hotspot see space courtesy see ht 
Medium	fire warn issue nsw south coast 
Medium	great news report send convoy tanker into 
Medium	information evacuation centre across nsw 
Medium	important number nsw rural fire service information line nsw rf please contact 
Medium	fire hank street heatherbrae now downgrade watch act 
Medium	fire still uncontained across nsw please contact public info amp inquiry line concerned 
Medium	fire near bell line rd burn approx hectare fire edge 
Medium	here nasa satellite photo show 
Medium	launch bushfire relief appeal help affect like donate please visit 
Medium	infrared image fire fire spot ahead very intense activity 
Medium	information employment protection nsw rfs member involve current fire 
Medium	mix mfb cfa fire crew equipment personnel deploy assist 
Medium	information employment protection nsw rfs member involve current fire 
Medium	smoke see williamtown airport 
Medium	advice hungerford creek fire muswellbrook immediate threat property ease 
Medium	status evacuation centre 
Medium	help home pet animal need temporary home narga volunteer would like hear https 
Medium	light our current gt employment entitlement during natural disaster emergency fact sheet 
Medium	try keep our page up date fire update around nsw come hand 
Medium	leppington close both direction between cowpasture rd denham court rd due 
Medium	twitter list important emergency service other important twitter feed 
Medium	fire flood park closure see late update alert national park across nsw 
Medium	urge resident prepare hot condition monday 
Medium	need someone talk call nsw mental health line 
Medium	incredibly proud public info team over last few day age technology immediate info 
Medium	home confirm destroyed damage springwood winmalee area 
Medium	very easy way donate people affect nsw bush fire xxx 
Medium	total fire ban declare great sydney great hunter illawarra central range until further notice due 
Medium	total fire ban until further notice area inc sydney hunter illawarra shoalhvn amp central range pls 
Medium	view fire mt st columba springwood 
Medium	medium release total fire ban until further notice 
Medium	fire now threaten st columba school 
Medium	sydney international regatta centre double helicopter refuel station amp water source 
Medium	amaze image october new south wale bushfires 
Medium	australian military probe fire link australia military investigate whether train exercise use 
Medium	explosive military exercise start massive bush fire australia new south wale 
Medium	state mine fire fire downgrade watch amp act 
Medium	our salvo store springwood open today offer support practical assistance bushfire affect local 
Medium	state emergency declare nsw premier barry farrell live 
Medium	effective immediately refers urgent level 
Medium	likely heavy smoke across sydney much state dont call just smoke only unattended fire 
Medium	must where all smoke blanket southern come even airport thick 
Medium	regular bushfire update available through nsw rf 
Medium	regular bushfire update available through nsw rf 
Medium	bilpin village expect become isolated electricity some day due prepare yourself now 
Medium	watch act hall road southern highlands wollondilly picton rd now open 
Medium	update big concern area wilton emergency warning issue resident should seek shelter 
Medium	break boy now charge lighting fire 
Medium	australian inferno nick moir photograph via 
Medium	new emergency warn issue burn ember blown towards wilton say 
Medium	medium brief commissioner shane fitzsimmons live stream now 
Medium	sydney water warn water pressure may low some area due extremely heavy demand fire fighting 
Medium	start rain lightly range here canberra hope also happen further north over fire 
Medium	smoke sit over penrith st mary 
Medium	situation new south wale nsw worsen fire burn emergency warning status 
Medium	info school closure 
Medium	need food blanket please donate official source full list find our web 
Medium	information hard hear 
Medium	rain windscreen look out firetrucks 
Medium	whoa amaze photo friend katoomba road blackheath 
Medium	anyone important reason blue mountains don 
Medium	queenslanders way help new south wale 
Medium	minute matter tomorrow ready leave early commissioner call fire threaten community 
Medium	saka water would like donate few thousand bottle saka water fire fighter nsw anyone 
Medium	my parent help control backburn mt york overnight kinda scary 
Medium	another photo firefighter crawl out flame backburn 
Medium	nasa satellite image take oct show 
Medium	cigarette butt cause please bin your butt 
Medium	hawkesbury showground become makeshift animal sanctuary due bushfire threat 
Medium	amazing terrify amaze photo friend katoomba road blackheath 
Medium	fire minmi edgeworth 
Medium	oakdale road resident chopper fly over police doorknocking ask resident prepare evacuate 
Medium	choppercam emergency warn issue area stockrington road west heading towards minmi http 
Medium	pic just now resident wait ready flee fire jump 
Medium	update gulguer nature reserve fire now contain crew remain scene patrol black out 
Medium	state mine photo mountain lagoon rd take hawkesbury gazette 
Medium	new watch act alert fire galston gorge take hold nw edge sydney trouble 
Medium	crew work hot smokey difficult condition bilpin pic 
Medium	our heart go out family lose home tip how support affect http 
Medium	stockrington rd fire reopen southbound northbound lane remain closed 
Medium	important information donation 
Medium	our volunteer evacuation centre springwood lithgow amp north richmond friendly face during cris 
Medium	investigation nsw rf fire investigator determine state mine fire start result live ordna 
Medium	defence department release extended statement into claim start state mine fire 
Medium	need info school closure today full list available here 
Medium	rf commissioner say still concern blaze 
Medium	branch blue mtns open today full service staff ready help thanks all bravely help during 
Medium	confirms plane waterbomber believe wing snap off before crash 
Medium	report chopper crash fight fire near ulladulla 
Medium	linksview rd springwood air crane deploy assist crew 
Medium	firefighter use twitter rapidly map respond nsw bushfire crisis 
Medium	customer text donate relief fund go our work amp other disaster 
Medium	pilot confirm dead crash fighting fire west ulladulla body yet retrieve rip 
Medium	emergency warning place fire near mount york rd fire near http 
Medium	pilot dy battle australia fire plane fight bushfires australia new south wale crash killin 
Medium	rip chief pilot david black nsw central west kill fight morning good man 
Medium	haha maybe use our fire near me app american tv network fire information 
Medium	recovery coordination centre news invitation subject public information meeting date 
Medium	oct nasa image give idea scale extent bush fire rag new south wale 
Medium	nsw rf hall rd fire likely contain afternoon thank all emergency service personnel hard work 
Medium	governor general quentin bryce visit blue mtns today thank firefighter 
Medium	update chilean interior minister report six dead state emergency declare part northern chile via 
Medium	powerful magnitude earthquake off chile kill least force evacuation 
Medium	resident flee magnitude earthquake strike northern chile 
Medium	davidnelsonnews nearly million people force evacuate after earthquake off chile coast 
Medium	tsunami warn however sea rise accord inch 
Medium	tsunami wave go hit hawaii result tuesday magnitude quake chile should happen around eastern 
Medium	massive quake hit near chile coast tsunami warn issue resident evacuate 
Medium	dead after powerful quake strike off chile coast 
Medium	magnitude earthquake hit northern chile voa news 
Medium	animation northern chile 
Medium	president our hq reach out local contact assess need after earthquake stay tune 
Medium	six people now confirm dead earthquake off northern chile 
Medium	massive quake chile update thousand return home limited damage dead 
Medium	pacific tsunami warn center advisory cancel follow off chile 
Medium	earthquake sw iquique chile thursday april utc thursday april 
Medium	indonesia lift tsunami warning after chile quake cctv 
Medium	update chile earthquake video dead tsunami warn chile peru ecuador 
Medium	abc world news now deadly earthquake strike off chile coast watch 
Medium	abc world news now deadly earthquake strike off chile coast watch 
Medium	chile begin assess damage earthquake 
Medium	chile earthquake how loss life damage minimize 
Medium	arrl ham alert wake chile earthquake 
Medium	chile earthquake magnitude earthquake strike chile tsunami warning 
Medium	magnitude km iquique chile 
Medium	five kill magnitude quake chile 
Medium	off coast tarapaca chile depth apr utc apr epicenter 
Medium	magnitude km tarapaca chile 
Medium	tsunami chile earthquake amazing footage 
Medium	off coast tarapaca chile depth apr utc apr epicenter 
Medium	massive earthquake off chile coast spark tsunami 
Medium	inmate escape after chile earthquake cnn rafael romo report aftermath magnitude earthqua 
Medium	earthquake aftermath chile 
Medium	felt strike km nw min ago please report 
Medium	powerful earthquake hit off chile trigger tsunami disaster declare after 
Medium	powerful earthquake strike off chile trigger tsunami break news april 
