Medium	don focus wind worry rain cabo delgado line serious flooding slow storm get more rain drop give place 
Medium	cyclone kenneth now refer overland depression say weather sa 
Medium	tropical make landfall already horrible storm behold whirlwind yehovah go forth fury even grievous whirlwind shall fall grievously upon head wicked jeremiah 
Medium	here expected track cyclone kenneth due make landfall northeastern mozambique 
Medium	know language people speak where amp how best communicate helps people understand life save info plan when severe weather hit preparedness key twb now map language response 
Medium	tropical cyclone intensity hit northern region mozambique year village storm hit experience storm magnitude weather underground explains 
Medium	kenya meet fear cyclone kenneth hit kenyan coast isiolo western samburu nairobi experience effect form enhanced rainfall 
Medium	now make landfall northern storm bring km wind already kill three people people force home amp more than people say risk because storm 
Medium	watch out cyclone kenneth move westward over mozambique channel expect land over tanzania amp mozambique hour 
Medium	meteorology inam ou rescue ingc fireman 
Medium	around pretoria joburg please come join u sunday join hand help affect flood 
Medium	pair trivisws image show today utc hour later just north utc data eview wind gust pressure forecast 
Medium	mozambique strong cyclone hit country leave least dead via 
Medium	appear head straight northen mozambique yet another cyclone row after only go affect southern tanzania strong wind rain expect reach coast mozambique hour thursday april night 
Medium	eye cyclone make landfall close island northern strong wind storm surge expect area next few hour heavy rain may persist across wider region day 
Medium	bbc cyclone people risk vox party much much more gmt 
Medium	just week after devastate passing country yet again face another dangerous cyclone powerful make landfall north country monitor situation closely 
Medium	initiate mapping activity preparedness measure respond predict expect hit most part mtwara tanzania mozambique please help u map here 
Medium	noon brief today late bangladesh update response live 
Medium	comoros ecmwf valid dangerous gust wave heavy rain thunderstorm 
Medium	kenneth slam comoros island en route mozambique dr jeff master category 
Medium	united nation give mozambique million cyclone kenneth damage united nation grant mozambique comoros islands million million pound emergency fund help provide food water repair damage infrastructure organisation sai 
Medium	get mozambique assistance program move advance another killer storm 
Medium	eu release million assistance northern wake devastation cause tropical cyclone 
Medium	new cyclone kill mozambique un warn flood possible san diego union tribune 
Medium	doubt quite humanitarian crisis process unfold yet another powerful tropical cyclone impact hopefully everyone stay safe light upcoming impact tc thanks share 
Medium	fresh devastation country reel cyclone idai omg wtf wtf wtf gt take out loan imf wake idai word just uk 
Medium	monster storm already claim life three people bear down coast pack mph wind dump rain cause intense flooding threaten hundred thousand people 
Medium	mozambique hasn even recover yet cyclone idai last month now path storm pray hope aid prepped ready go people mozambique 
Medium	official cyclone kenneth now strong storm make landfall recorded history mozambique entire african continent allow disaster go unseen donate help our brother sister time need 
Medium	hit put child family danger mozambique still struggle cope impact march donate our appeal help u keep child safe 
Medium	spokesman mozambique disaster management institute ingc beleza say one person kill fall coconut tree pemba cabo delgado follow strong wind connection hit country northern region friday 
Medium	violent wind up kph lash east african island nation comoros overnight kill three people authority say thursday tropical swept towards flood batter mozambique southern tanzania 
Medium	produce max min wind kt mph make tenth intense cyclone record breaking swio season max record wind prince say ibrahim int airport kts mph utc eat 
Medium	batter northern mozambique sustained wind up kilometre per hour late thursday after kill three people island nation comoros overnight 
Medium	please warn all your friend relative colleague let save life cyclone kenneth fast approach mozambique coastline via 
Medium	africa possibly strong ever cyclone hit east coast africa make landfall tonight affected area northern southern threat rain flood amp landslide possible wind up another humanitarian catastrophe loom 
Medium	northern mozambique comoros badly hit central mozambique still reel stand solidarity affected people release million friday swiftly respond immediate need 
Medium	cyclone kenneth flood fear heavy rain hit mozambique 
Medium	cyclone kenneth look more impressive eye start appear microwave pas show close healthy look storm rapid intensification next hour may become first time mozambique hit cyclone same year 
Medium	storm kenneth kill more destruction ahead 
Medium	cyclone kenneth death toll mozambique rise rain continue 
Medium	thinking all staffer give percent make sure people need aid preparation gear up brace second massive storm 
Medium	hit land emergency response team get ready support forecast rain up metre next day wind up result another humanitarian crisis like flooding landslide 
Medium	cyclone kenneth make landfall northern mozambique country still recover another huge storm more than people die when storm idai bring devastation mozambique malawi zimbabwe 
Medium	two major storm two month mozambique usually only expect one major storm per decade more than people evacuate high risk area ahead tropical cyclone kenneth now many people still risk 
Medium	hit aftermath kenneth via 
Medium	capture view tropical cyclone viirs day night band just hour after cat storm roar ashore thursday kenneth first storm make landfall over mozambique cabo delgado province last year more 
Medium	say kenneth now recede into tropical depression damage destroy home while people house emergency shelter 
Medium	respond humanitarian crisis check out dozen relevant actionable datasets 
Medium	rain ground aid flight cyclone hit mozambique stockawiki fast break financial news pemba mozambique reuters rain grounded aid flight northern mozambique second day monday leave 
Medium	powerful cyclone barrel towards northern mozambique cyclone kenneth form indian ocean strengthen while make way towards northern mozambique would 
Medium	our help still need former mozambique president appeal help after cyclone devastation enca donate online via 
Medium	first time recorded history two strong tropical cyclone hit mozambique same cyclone season estimate million people need urgent food nutritional support 
Medium	disaster speedy support save life go example responds 
Medium	press release additional child risk after spox available 
Medium	health professional already volunteer since last hurricane idai 
Medium	after brace second impact tropical storm kenneth 
Medium	thank brazilian national force provide support population vulnerable zone cabo delgado after cyclone keneth 
Medium	before hit country country account death around world more than case report since march one bad affected province 
Medium	child rescue brazilian firefighter child already need urgent aid mozambique after first cyclone additional child risk after re ground all keep child family safe 
Medium	another possible cyclone heading towards mozambique tanzania expect thursday while durban flood dead fear more flooding overnight 
Medium	mozambique batter second major cyclone week unprecedented drive world poor country far into debt 
Medium	second cyclone hit mozambique leaf five dead home flatten 
Medium	here some figure accord people need humanitarian aid among kid woman injure lose shelter time show compassion heal learn 
Medium	continue toward wsw through friday bring hurricane force wind rain forecast graphic courtesy 
Medium	mozambique un appeal int support wake cyclone 
Medium	due passage cyclone kenneth may affect province cabo delgado today lam maputo pemba pemba maputo flight tomorrow cancel 
Medium	tropical cyclone now intensify category hurricane strength after passing head north amp over month ago cause death region 
Medium	late cloud top height satellite animation past hour cyclone kenneth terrify time people our thought prayer during time 
Medium	almost people take shelter makeshift displacement centre include school church 
Medium	hear team ground even bad than please donate community desperate need 
Medium	our heart go out community around fellow member where hurricane force wind reach few hour ago people flee high ground situation terrify 
Medium	hi rob darker color indicate high risk here more detailed explanation map here article offer more context 
Medium	deeply sadden loss life destruction cause southern africa un release fund humanitarian response appeal international community additional amp much need resource 
Medium	cyclone kenneth slam into mozambique northern province cabo delgado pound region rain 
Medium	aftermath result least death home destroy would like send our upmost sympathy family lose love one pray everyones safety read full update 
Medium	mozambique cyclone idai destroy percent beira drone footage di 
Medium	regional cyclone monitoring center french island say kenneth make landfall around gmt north pemba expect weaken move inland 
Medium	cyclone kenneth lead cholera most risk 
Medium	aerial footage show collapse home waist deep water town pemba mozambique cause least people die more risk more rain forecast 
Medium	head today picture show damage cause district province un say some entire community completely destroy 
Medium	cyclone kenneth hit mozambique dec member charity already ground help affect cyclone idai our appeal still open 
Medium	cyclone kenneth thousand people evacuate mozambique ahead major storm 
Medium	cyclone kenneth mozambique death toll 
Medium	very happy support suffer lot receive tarpaulin amp other product say antonio ingoia amp mozambican red cross society distribute essential supply help family affect 
Medium	least people dead after cyclone kenneth hit northern mozambique last thursday flooding ongoing only week ago cyclone idai kill people mark time recorded history two cyclone hit mozambique sing 
Medium	closing northern mozambique affect already devastate mozambique also affect tanzania storm exceptionally intense strength very rare see make landfall just south tanzania close equator 
Medium	cyclone kenneth hit french island mayotte head mozambique guardian news 
Medium	scene destruction via many home destroy fall tree restrict road access right now team ground assess damage supporting emergency response more update come 
Medium	second natural disaster hit less than day just last month take estimated life destroy over home million acre crop please help u make urgent donation 
Medium	scene pemba moment now mov via 
Medium	mozambique receive million un cyclone kenneth damage 
Medium	update daniel timme emergency response expert ground supply pre position help affected family donate now support unicef emergency relief work 
Medium	cyclone kenneth land north mozambique today wind speed over rain stay strong mozambique 
Medium	travel ten thousand evacuate cyclone kenneth hit mozambique 
Medium	amp partner deploy assessment team area likely affect provide dwindle pre position stock support community 
Medium	water water water flood northern mozambique 
Medium	cyclone commence landfall across northern mozambique extreme wind excess along significant storm surge expect furthermore torrential rainfall likely lead widespread flooding 
Medium	cyclone kenneth currently catagory storm sustained wind mph central pressure currently head north east coast mozambique near border malawi expect make landfall catagory storm 
Medium	tropical storm form off madagascar storm set sight mozambique coming day target area slam cyclone idai last month 
Medium	new cyclone hit mozambique send rescue team help affected area 
Medium	cyclone less than week after struck another cyclone form look set hit country north thursday 
Medium	icymi joburg tropical storm kenneth predict affect south africa weather mozambique brace itself severe weather 
Medium	kill flood worsen mozambique after second cyclone guardian nigeria news nigeria world news 
Medium	strengthen depression move towards coast rain heavy widely near center rainfall over over mm likely 
Medium	new cyclone likely hit tanzania mozambique week amount rainfall expect result life threaten flood accuweather warns 
Medium	collection microwave satellite image show eye cyclone near ngazidja grande comore comoro islands earlier today source navy nrl 
Medium	mayotte cyclone prompt suspension air traffic international airport until april 
Medium	sadly need stop methane emission yesterday 
Medium	people affect death wound house partially totally destroyed point view preliminary data ingc until april 
Medium	our just local problem hyper active hurricane season indian ocean deliver historic tropical cyclone last week first one kill over people one potential even bad 
Medium	sent tonne humanitarian aid cyclone hit emergency ministry 
Medium	daraja tanzania partner cci work tma medium amp community leader prepare resident direct weather information amp advice tma pass community timely manner cci use whatsapp sm amp word mouth 
Medium	expect affect southern part tanzania northern side mozambique 
Medium	currently move onto tanzania mozambique month after cyclone idai devastate region 
Medium	video mozambique montepuez river swell after cyclone kenneth raise fear flood 
Medium	just before cyclone kenneth hit our team member raul send update mozambique deploy additional staff region weekend need 
Medium	least people displace after hit island state cyclone wipe out nation food crop leave most inhabitant without power source 
Medium	tropical cyclone kenneth track position wsw wind 
Medium	southern tropical should make landfall around april may cause flash flood landslide disrupt essential service follow instruction local authority 
Medium	travel five dead home flatten after cyclone hit mozambique guardian 
Medium	strengthen tropical cyclone threaten tanzania mozambique 
Medium	dear god when ask help me bring change world didn mean kind change tropical storm now approach mozambique 
Medium	monitor closely remain vigilant risk flood southern coming day amp stand ready help tanzanian authority request our thought local community 
Medium	rain pull moisture away nippy night ahead friday become warm saturday sunday friday saturday sunday 
Medium	more than people evacuate high risk area mozambique ahead tropical cyclone kenneth people still risk 
Medium	nearly people risk tropical storm pummel mozambique over month far response provide assistance million people find out preparation response 
Medium	phenomenal job feed victim disaster amp humanitarian crisis around world thank another cyclone approach mozambique please consider donate jose amp all hero support world central kitchen 
Medium	blog map satellite 
Medium	expression interest english medical volunteer cyclone response mozambique adventist help consider emergency medical intervention central mozambique 
Medium	april still place unaccessible mozambique people whose situation unknown authority still try get cyclone kenneth bring more rain make situation worse 
Medium	travel advice tropical storm kenneth forecast make landfall tropical cyclone northern mozambique thursday april more info 
Medium	nearly home part northernmost cabo delgado province partially fully destroy electricity cut least one key bridge collapse 
Medium	tropical cyclone kenneth make landfall pm local time april north pemba mozambique accord joint typhoon warn center kenneth mph wind landfall very heavy rain expect kenneth cabo delgado province 
Medium	need worldwide humanitarian movement build basic infrastructure everywhere include proper housing road water supply electricity etc afford bbc news entire village wipe out say un 
Medium	mozambique just try rebuild after idai now 
Medium	rescuer try reach remote village where powerful cyclone cause widespread devastation thousand may trap heavy rain high wind risk more 
Medium	first sign arrival cyclone kenneth northern mozambique image show stormy weather along coastline pemba northern mozambique country brace arrival new cyclone barely month after cyclone idai devastate country 
Medium	our volunteer alert make way potentially tanzania mozambique full info here 
Medium	un say grant million emergency fund help cope second tropical storm hit country within week 
Medium	now ex tropical cyclone bring metre rain across part northern mozambique next day severe flood mudslide likely 
Medium	violent wind up kph lash east african island nation overnight kill three people authority say thursday tropical swept towards flood batter southern 
Medium	update un give mozambique damage least people kill rescuer fear safety thousand family cut off burst river bank videos share social medium show people wag through deep flood water 
Medium	begin sunday part northern mozambique hit day ago government urge people immediately seek high ground hundred thousand risk 
Medium	wfp watch approaching northeastern closely storm hit north expect heavy rain provoke flash landslide impact northeastern province cabo delgado nampula 
Medium	good news kenneth hit area affect cyclone idai storm head northern mozambique beira clear 
Medium	light please see information poster disaster planning recovery focus group 
Medium	just clear go hit land near tanzanian border km northeast beira where tc idai come ashore nevertheless another major hurricane hit such poor vulnerable nation within such short time devastate 
Medium	ocha wfp unicef icrc ifrc save child oxfam care international cosaca among other organization express our solidarity people explain government ready support 
Medium	new mozambique storm rip off roofs brings lash rain aid response kick tropical swept into northern thursday even bring heavy rain wind excess kilometre per hour mile per hour 
Medium	mozambique damage flood main stream medium pick ph thank 
Medium	re ground work our partner provide emergency aid after now well nearly million people need provide life give assistance family affect storm 
Medium	violent wind cause landslide flood cut off road comoros ahead tropical storm 
Medium	powerful dangerous tropical cyclone kenneth slam into northern mozambique within hour bring damage wind torrential rain coastal storm surge landslide flood ll make landfall sparsely populated area flooding region concern 
Medium	bring massive warn 
Medium	cyclone kenneth hit mozambique country still reel devastation idai video 
Medium	news just get lot bad second major cyclone hit one poor nation earth never happen recorded history two major cyclone hit mozambique one season increase liklihood 
Medium	indian ocean nasa examine tropical cyclone infrared light atmospheric infrared sounder air instrument aboard nasa aqua satellite pass over tropical cyclone kenneth analyze storm infrared light 
Medium	risk mozambique after cyclone week abc news via 
Medium	mozambique still grip intensive flooding cause cyclone kenneth wipe out entire village when make landfall last week thursday tjm 
Medium	late wake up call climate emergency historic cyclone hit still reel mozambique via 
Medium	cyclone expect land thursday orrigibated southern indian ocean tanzania meet office warn may bring life threaten weather province mtwara lindi neighboring mozambique 
Medium	live stream tomorrow regard sure time yet 
Medium	death toll hit after cyclone kenneth slam into mozambique local authority say monday cyclone kenneth make landfall country northern coast thursday flooding continue 
Medium	hit kenneth week after ain normal video neil smith eye storm island 
Medium	sad death toll cyclone kenneth rise flood continue mozambique 
Medium	expect stall bring year worth rain over several day increase stalling tropical cyclone observe globally attribute 
Medium	cyclone kenneth wipe out mozambique village follow strong cyclone ever hit mozambique friday kenneth entirely wipe out village towards northern border arrive just month after cyclone idai kill more than people across east african nation 
Medium	image comoros show damage cause cyclone kenneth pass island overnight category storm since gain strength now category head nothern mozambique southern tanzania 
Medium	volume rain would nearly double day accumulate rainfall cause flooding beira during cyclone idai 
Medium	cyclone see amazing photo storm thousand innocent people life amp livelihood devastate live through 
Medium	must stay alert avoid touch fall power cable wait permission before drive keep child home 
Medium	mozambique brace cyclone kenneth batter comoros 
Medium	tropical storm cyclone heading northern 
Medium	surpass both cyclone strong date hit province wind speed bring threat extreme rainfall 
Medium	around patient treat over past day mozambique emergency medical team deploy through help provide health care people cyclone affect area 
Medium	over people affect late cyclone mozambique authority say unicef estimate child need help red cross federation seek fund provide emergency aid people 
Medium	update tropical make landfall weather authority warn head tanzanian coast now join live dar e salaam our correspondent daniel kijo story sabc digital news 
Medium	tropical storm kenneth threaten mozambique tanzania later week 
Medium	just awful remember most victim very little start off very little any disaster support government sadly expect number increase coming day week 
Medium	cat tropical cyclone bring destruction just week after rare tc leave thousand dead hear news soon image meteosat ctsy eumetsat 
Medium	least five people dead after cyclone make landfall northern mozambique intense storm make landfall just six week after destructive cyclone kill more than people mozambique 
Medium	cyclone kenneth hit northern mozambique friday leave one person dead destroying home infrastructure 
Medium	imagine houston get hit cat hurricane week after hurricane harvey scenario play out poor nation world just lose people cyclone idai now threaten sound alarm 
Medium	devastates just after week when make landfall much still unknown damage remote area major flood become next threat life river already high more rain come aid desperately need 
Medium	cyclone ravage mozambique threaten new tropical storm 
Medium	cyclone kenneth un say mozambique may need another huge aid effort still reel cyclone idai country hit strong ever record storm 
Medium	situation likely compound torrential rain forecast predict rainfall over coming day cause severe flash flooding 
Medium	develop extremely dangerous tropical cyclone kenneth make landfall mozambique 
Medium	ireland inconvenience u weekend come heel mozambique life change amp devastating consequence 
Medium	grapple authority raise concern potential flood malawi still recover kill over across three country include our nick brook recently malawi watch 
Medium	late tropical cyclone kenneth category sustain wind move wsw km expect make landfall vicinity quiterajo north eastern mozambique evening 
Medium	may god people mozambique today next day country target another cyclone 
Medium	flood after cyclone picture courtesy kevin record 
Medium	un appeal international support flood water rise wake second mozambique cyclone 
Medium	devastate flood barely month after more rain forecast hundred thousand people big risk some village entirely wipe out anyone out 
Medium	bbc news mozambique flood bad than think un agency 
Medium	mozambique cyclone death toll rise storm block aid 
Medium	cyclone kenneth make landfall hundred thousand anticipate affect follow landfall volunteer prepare community more update 
Medium	hope aware implement proper water borne virus protocols cyclone ravage mozambique need protocol hugely potentiate alpha togaviridae flavivirus flaviviridae hotspot 
Medium	serious flood begin sunday part northern hit cyclone kenneth three day ago water waist high place after government urge many people immediately seek high ground 
Medium	cyclone idai claim life across southern africa force into camp march estimate loss billion mozambique gdp kill amp uproot region again already swallow life innocent 
Medium	bad storm ever new cyclone hit mocambique 
Medium	help map mozambique provide data support hit use link below access task 
Medium	our thought prayer mozambique comoros tanzania brace possible impact tomorrow just over month since make landfall mozambique emergency team remain ground responding preparing 
Medium	cyclone kenneth hit northern mozambique thursday just week after country suffer cyclone idai far south un grant nation million emergency fund 
Medium	preparation mozambique tanzania kenneth loom via 
Medium	visit website photo destruction after cyclone kenneth ravage mozambique amerislamunderway 
Medium	mozambique additional child risk after second cyclone unicef 
Medium	likely wind equivalent cat strength when make landfall mozambique strong very high wind widespread flooding add already terrible situation 
Medium	thread situation mozambique amp surround country still struggle just week ago peak harvest time extreme flooding amp weak health system mean lot risk global community must respond quickly 
Medium	wake death devastation wrought cyclone kenneth ten thousand people far north mozambique now face threat violent flooding torrential rain dangerously push up water level 
Medium	tropical cyclone see here april track pass near comoros islands before make landfall near tanzania mozambique border later week learn more 
